"Unique Id","Call Id","Words"
1019,"731657618.0","what you're speaking is Jon Surfs now we're trying 7228 Lloyd I'm calling them yes some of the stores and 2nd Street "
1020,"732855393.0","alright thanks man "
1021,"732855393.0","alright thanks man "
1022,"732855393.0","parking okay alright and I put you on hold for one woman kind of her do you own thank you hi there are coming from there bye perfect male our office at 733 Wiley Street no problems so I will normally a couple Soroka normally normally take a $59 not to separate these days are a fucking going to come in and see what the problem is with a $59 cast Bass parts or parts or get the car to come back in store for whatever reason it's an older unit the parts or if it's not worth fixing that you know so no I do have them available now I just don't okay can you cook a whole double check her calendar here tomorrow around 6 if someone will call you when I'm coming home perfect "
1023,"732855393.0","alright thanks man "
1024,"732855393.0","alright thanks man "
1025,"732855393.0","alright thanks man "
1026,"732878088.0","I just want you cuz I don't want to go back in so you have a chance okay calculation okay so if you upload the proper line okay as soon as you can okay "
1027,"732878088.0","Fortune 283 model unit I purchased one sure cuz I don't want to go back in so you have a chance exclamation okay so if you have a proper okay as soon as you can okay alright "
1028,"732878088.0","Fortune do a great trip model unit push this one through cuz I don't want to go back in so you have a chance calculation that's nice getting in okay so if you upload the proper okay as soon as you can okay alright "
1029,"732878088.0","which okay I just want you cuz I don't want to go back in Saudi you have a chance calculation fucking okay so if you upload the proper line okay as soon as you can okay "
1030,"732878088.0","Fortune Mitri I purchased one sure cuz I don't want to go back in so you have a chance calculation getting in action fuckers okay so if you are Parker okay as soon as you can okay "
1031,"732878088.0","how are you 2838 I purchased one share cuz I don't want to go back in you have a chance car okay calculation okay so if you have a proper okay as soon as you can okay alright "
1032,"732985416.0","7103 "
1033,"732985416.0","7103 "
1034,"732985416.0","okay give me a call back "
1035,"732985416.0","give me a call back "
1036,"732985416.0","7103 "
1037,"732985416.0","okay give me a call back "
1038,"733100090.0","it's Christmas time okay tomorrow something like that Camaro C Wilson and everything else and then when he's done he's able to accept cash check Visa Mastercard right after the work done okay okay I promise 7291 breakfast so okay see you okay bye "
1039,"733100090.0","okay now I'm sad I'm working and our our summer rates and everything else and then when he's done he's able to accept cash check Visa Mastercard right after the work's done okay my plumber let him know you're Springer 7291 okay "
1040,"733100090.0","okay "
1041,"733100090.0","from side I'm around and everything else and then when he's done he's able to accept cash check Visa Mastercard right after the work's done okay okay I promise let us know okay number five one nine 7291 bread love you okay bye "
1042,"733100090.0","okay now I'm sad everything else and then comma park right after the work done okay okay give you a call I will I promise I'll let him know okay bye 7291 Brooklyn so okay alright thank you okay bye "
1043,"733100090.0","okay now something like that comma row seats and everything else and then when he's done he's able to accept cash check Visa Mastercard right after the work done okay okay I promise okay if you are you can 791 okay alright thank you okay bye "
1044,"733158841.0","thank you bye bye "
1045,"733158841.0","thank you bye "
1046,"733158841.0","thank you bye bye "
1047,"733158841.0","to them so you can have a look and see for 4 days and so forth for your house and supervise okay so I just heard that in the notes as well and that's Mike Jarvis it's going to be coming over thank you bye "
1048,"733158841.0","to them so have a look and see before for your help bye I can pick her more information so okay alright I just heard that in the notes as well and got my starving that's going to be coming over thank you bye bye "
1049,"733158841.0","to them so have a look and see before days and so forth for your house and people like that okay I can pick her more information so okay okay alright I just heard that in the notes as well and got my Starbucks going to be coming over thank you bye bye "
1050,"733532741.0","you have more information "
1051,"733532741.0","how are you see if I can get somebody to go to my mother's house next door or whatever wired into our bedroom or before work number it's required to do so s i r l e y Street is 10 one 181 433 474 19452 hurt her between 11:18 a.m. morning you are you have more information "
1052,"733532741.0","you have more information "
1053,"733532741.0","how are you if I can get somebody to go to my mother's house next door or whatever what up wired into our bedroom or number r r a n s i r l e y Street 10161 181 433 474 19452 tired of her her between 11 and 2 morning you are you have more information "
1054,"733532741.0","you have more information "
1055,"733532741.0","you are you have more information "
1056,"733612984.0","air conditioner wasn't working the first part of the Furnace deleted everything but he couldn't seem to find her massage I didn't fix it so anyway I'm I am like a cracker with me know you tell me to be done I don't know what happened I would like with me at all yes my name is Nancy Survivor working on the summertime was it something different okay well over $1,000 for the problem was discovered that in this Pro V be removed is Belle Tire in the front did not discuss it with me in order for me to get with discover and I don't think I should have to pay clothes in the summer time I open up an account and I can see where he has removed and then we attached family trying to figure out what was wrong with the furnace "
1057,"733612984.0","air conditioner wasn't working the first part of the first cuz you said everything was fine but he couldn't seem to find it I've been sick so anyway I am like a just me with me at all 26003 no yes my name is Lisa Becker I'm working on the phone he was a different okay for the problem is the purpose of this fire in the furnace did not discuss it with me in order you made it was discovered it and I don't think I should clothes in the summer open up and I can see where he has removed and then we attached Emily's trying to figure out what was wrong with the fur "
1058,"733612984.0","hi my air conditioner wasn't working the first part of the Furnace cuz if it is pretty couldn't seem to find girls I didn't I didn't fix it so I'm not sure what anyway I am like a male between minutes cracker with me know you did tell me to be done I don't know what happened I would like it yes my name is Nancy forgot her I'm working on a summer she was a different okay for the problem with this fire in the car with me and I don't think I should clothes in the summertime and open up a new account and I can see where he has removed and then we have family trying to figure out what's wrong with the furnace or the air conditioning "
1059,"733612984.0","my air conditioner wasn't working the first part of the Furnace so they said everything was fine but he couldn't seem to find it I've been sick so I'm not sure whether this anyway I am like I missed me with me at all 26003 no yes my name is Nancy Survivor I'm working on a story something different okay for the problem with the fire in the furnace did not discuss it with me or tell me to get this covered and I don't think I should clothes in the summertime and open up a new account and I can see where he has removed the holes and then we attached Emily's trying to figure out what was wrong with the furnace or the air conditioning "
1060,"733612984.0","hi my air conditioner wasn't working the first part of the Furnace deleted everything pretty couldn't seem to find it I couldn't fix it so I'm not sure what anyway I am like I missed me Filipino yes my name is Nancy forgot her working on the phone was it something different how's it going for the problem is the dog Discovery purpose remove this down to fire in the furnace did not discuss it with me in order and it was covered and I don't think I should clothes in the same time I open up an account and I can see where he has removed and then we I can't believe I get to go "
1061,"733612984.0","hi my air conditioner wasn't working the first part of the Furnace cuz you said everything was fine but he couldn't seem to find I couldn't fix it so anyway I am like a person with me know you did tell me to be done I don't know what happened and I would like yes my name is Nick it's about her working on the phone was it something different okay well over $1,000 for the problem is the purpose of this bill to fire in the furnace did not discuss it with me what it was and I don't think I should clothes in the summertime and open up a new account and I can see where he has removed the holes and then we have family when you try to figure out what's wrong with the prayer dear can assess me know "
1062,"734374738.0","no 1X percent perfect thank you thank you bye "
1063,"734374738.0","what is what is not and then go from there you know on Thursday you can expect her to Christian's birthday okay thank you bye "
1064,"734374738.0","you know what you can expect her to Kristin okay perfect thank you thank you bye "
1065,"734374738.0","no problem okay no problems currently scheduled minded person to come out and Harley okay hello no problem now if I can take them for me and we can set up an appointment to come on site go over with you from there okay yeah oh I see okay well sorry for your loss okay alright cool I like I said I can take some information I will our scheduler if you want to 456 Park Road on Crescent in London Ontario your phone number if you want yours then Cooper how we work we will schedule like I said our electricians will come on site over everything first give you an accurate price go ahead with the work to be done quickly to sign up for parts on this sucks but it's in stock right away okay Visa or MasterCard I can do a Thursday night good morning afternoon also are you know put that in hi Carla my hi believe I've got everything okay so just you know give us a call okay no problem we'll Hills what is not and then go from there you know on Thursday you can expect her to Kristin okay perfect thank you thank you bye "
1066,"734374738.0","problems okay okay no problem no problems currently scheduled minded person to come out and Harley okay okay no problem now if I can take some information and we can set up an appointment like I said I will come on site go over with you from there okay yeah oh I see okay well sorry for your loss cool I like I said if I can take some information I will a scheduler or you want us before the end of the month is that correct 4564 Taunton on Monday night period your phone number I got for you want yours then Cooper how we work we will schedule like I said our electricians will come on site over everything first give you an accurate price go ahead with the work to be done to the final Parts on this sucks but it's in stock right away okay these are MasterCard I can do Thursday in life for morning afternoon also are you know when I'll put that in okay I hi I believe I've got everything call cost oh yeah okay no problem what is not in the go from there Perfect Two "
1067,"734374738.0","what is not and then go from there you know on Thursday you can expect or anything okay thank you bye "
1068,"734719905.0","okay "
1069,"734719905.0","okay "
1070,"734719905.0","okay "
1071,"734719905.0","okay "
1072,"734719905.0","okay "
1073,"734719905.0","okay "
1074,"734981569.0","okay so I've gotta vitamins note and we charge your furniture no problem I will schedule you for a time to come back out if you have any okay the first available half I can put in the movies with Brad and then I swear okay so much bye "
1075,"734981569.0","come out as a point okay so I've gotta vitamins note everything store no problem no problem I will schedule you for a time to come back out with you okay the first available half I can put on the message there Friday okay okay perfect "
1076,"734981569.0","come out okay okay so I've got a buddy no problem I will schedule you to come back okay the first available half you have any if you're not "
1077,"734981569.0","my name is Paul diamonds coming come over and I wrote down and park you notice a messages on the permit but I received an email message today I know respond email message a couple weeks ago and I looked at it and I kind of ignored today coming today on the email similar before girl working right now Rashun white calibration 390 are you done for years ago or time so I need to go earlier a service that was done if you would ring through the automatic thank you "
1078,"734981569.0","my name's Palm Island coming come over and I wrote down and park you notice a messages on the permit but I received an email message today and no response email message I could go and I looked at it and I kind of ignored today coming today on the email similar before right now Rashun Rashun 390 are you done for years ago or time so I need to go earlier a service that was done if you would ring through the automatic bird is on a Friday thank you "
1079,"734981569.0","my name is Paul diamonds coming come over in my way down overnight and messages on the but I received an email message today I know respond email message a couple weeks ago and I looked at it and I kind of ignored today today either before right now Rashun Rashun failure 39 Simcoe crap are you done for years ago or time so I need to go earlier a service that was done if you would ring through the automatic is on a Friday thank you "
1080,"735310556.0","this is Norma Perry speaking of somebody call me a little while ago don't have a Tony the Prada come here at 8:30 or 8:30 tomorrow Norma Perry Norma Perry calling this phone number while ago regarding Tony plumber coming her home tomorrow morning that's between 8:30 appropriate parking come in at 9 to get them out of there probably by the time they come and they need the water to say clean him and everything so would you have to come like later in the morning like usually sooner Tyrone see what happens okay well thank you very much very much "
1081,"735310556.0","yes somebody call me a little while ago so having Tony the plumber come here at 6:30 or 5:30 tomorrow Norma Perry Norma Perry calling Alex phone number while ago regarding Tony plumber coming her home tomorrow morning that's between 8:30 appropriate the Parkinson's come in at 9 to get them Autosound by the time they come and they need the water to stay clean him and everything so would you be able to come like later in the morning like usual Arthur you would have to say okay well thank you very much that was fashionable very much "
1082,"735310556.0","penis a little while ago don't having Tony the Prada come here at 6:30 or between 8:30 tomorrow Norma Perry Norma Perry calling weather this storm while ago regarding Towing plumber coming to our home tomorrow morning at 3:30 Harkins come in at 9 to get them Autosound by the time they come and they need the water to say clean him and everything so would you be able to come like later in the morning like III usually sooner Tyrone yeah 11 and then I'm coming down at 1 you would have to turn the water off okay well thank you very much that was fast "
1083,"735310556.0","this is Norma Perry season of somebody call me a little while ago don't having Tony the proper come here at 8:30 or 8:30 tomorrow Norma Perry okay thank you Norma Perry calling message for Tony plumber coming her home tomorrow morning that's between 8:30 appropriate because he has Parkinson's come in at 9 to get them Autosound by the time they come and then the water to stay clean and everything so would you be able to come like later in the morning like usual Arco yeah 11 and then I'm coming down at 1 you would have to say okay well thank you very much that was fashionable "
1084,"735310556.0","don't having Tony the plumber come here at 8:30 or between 8:30 tomorrow Norma Perry Norma Perry calling text regarding Towing plumber coming to our home tomorrow morning at between 8:30 Harkins come in at 9 chicken Autosound probably by the time they come and they need the water to say clean him and everything so would you be able to come like later in the morning like usually Sinister wrong Arthur you would have to turn off okay well thank you very much so affectionate "
1085,"735310556.0","this is Norma Perry speaking of somebody call me a little while ago so having Tony departure come here at 8:30 or 8:30 tomorrow Norma Perry Norma Perry calling with his phone number regarding Towing plumber coming to our home tomorrow morning that's between 8:30 Harkins come in at 9 to get them Autosound by the time they come and they need the water to say clean him and everything so would you be able to come like later in the morning like usually sinister Arco care and then come get one you would have to turn off okay well thank you very much that's it "
1086,"735698948.0","up for early next week comma who is the best time so we're not sure what the problem is no Mike of a specific of one of our stores yeah Kristin Tuesday okay Oakland okay so I'm call me on the weekend okay is that we're when do they start okay Google "
1087,"735698948.0","and I look at it now phone number 509-679-5196 I have a shower 519-319-9436 okay perfect so okay so are we schedule I just housework reschedule our signals most part on there also they want to go to work right away okay so and then when they're able to pass that he's a MasterCard Albuquerque so first thing as quickly as I could so that you require first thing for Casey morons I will have someone give you a call to confirm okay I know exactly what the cost is okay we are on site between 6:30 their first call of the day okay have a good "
1088,"735698948.0","this my last attempt I can make it bye can I look at now okay Travis phone number 519-679-5196 and I have a shower 519-319-9436 okay perfect so okay so I will schedule you just help us know how we schedule our take a look over everything you know what the price on there also they want to work it out from there okay so and then when they're still able to help aspects he's a MasterCard boom available for first thing I put three of us could probably require first thing for Casey morons I will have someone give you a call to confirm okay I think that's why I know exactly what the process okay we are on site between 6:30 their first call of the day okay have a good day "
1089,"735698948.0","thank you sir bye bye "
1090,"735698948.0","okay we have to change the cartridge couple of times so we're not sure what the problem is okay okay Oakland okay so call me on the weekend okay it's a trigger when do they start okay hey can you cook okay bye "
1091,"735698948.0","and I look at now phone number 519-679-5196 and I have a shower 519-319-9436 okay perfect so okay so I will schedule you just help us know how we schedule our pay for everything you know what the price on there also they want to get some pricing so and then when they're able to pass that he's a MasterCard available I can do boom of Albuquerque so I think my personal mobile Quick Draw that you require first thing for Tuesday morning damn I will have someone give you a call to confirm okay I know exactly we are on site between 6:30 their first call of the day I'm sure they are okay thank you have a good day "
1092,"735868857.0","thank you "
1093,"735868857.0","thank you "
1094,"735868857.0","thank you "
1095,"735868857.0","thank you "
1096,"735868857.0","okay "
1097,"735868857.0","thank you "
1098,"736074862.0","Republican John Fidel opted in trouble years ago we're having trouble with the one breaker I think it needs replacing a couple how to go I'm someone or how does this work our from the house to that breaker the breakers I guess going to be but I need you guys come on tell me 5 here on Green Huron Greenhill 45516 you have yet I can't member last time together okay are you in the morning okay okay very much "
1099,"736074862.0","very much "
1100,"736074862.0","very much "
1101,"736074862.0","it would be the second car okay "
1102,"736074862.0","765-092-7746 perfect it's no different you know Bieber her mornings afternoons and then I will it sounds like it political I will put that in Howard it would be the second call "
1103,"736074862.0","green McAllen Texas I have fiber 985-880-7746 okay now that you know they will be asked to come good morning something again that I love someone earlier I will put that in Howard it would be the second call "
1104,"736356546.0","Maria speaking how can make it bye no problem I don't know what that is 666 711 okay alright so we were out to your sick like a sticker rude towards coming home okay alright okay to do some covering around okay there will be a $90 from Google for us "
1105,"736356546.0","Maria speaking how can I make you feel no problem I don't know we got it 6867 11 alright so we were out vehicle I guess they can correct the problem you're okay okay okay do some covering around the other call okay if you are priority thanks for everything "
1106,"736356546.0","Maria speaking how can I make you smile oh dear no problem I don't know we got everything 6711 alright so we were out to you look like a stick incorrect or you have a problem you're okay alright okay compartment around okay if you are priority so like I said it will be awesome and we'll go over everything "
1107,"736356546.0","Maria speaking how can I make you smile no problem I don't know what that ever 796 six eight six 711 alright so we were out two years act like a stick incorrect or you have one you're okay to do some covering around the other call okay our priority there will be a no go for us "
1108,"736356546.0","Maria speaking how can I make you smile oh dear no problem I don't know what that ever 7-Eleven alright so we were out some vehicle I guess they can correct the problem you're okay okay do some covering around the other call okay if you are priority pick up there will be a 99/6 "
1109,"736356546.0","Maria speaking how can make you smile no problem I never got it 7666 711 alright so we were out sick like a sticker ruden's correct or you have to have your okay okay okay do some covering around okay if you are priority pick up there will be a 99/6 "
1110,"736536668.0","okay proposal from the Earth price for the Easter hour so instead of 149 inch start with it it's nice yeah so 72195 apparel "
1111,"736536668.0","72195 "
1112,"736536668.0","72195 "
1113,"736536668.0","yeah "
1114,"736536668.0","your call 2195 "
1115,"736536668.0","72195 "
1116,"737062868.0","Lincoln alright I'm there as possible after like 5 or so okay sorry hi there it's a okay and someone else your furnace Q "
1117,"737062868.0","and someone else "
1118,"737062868.0","smile wrinkly okay alright I'm on there as soon as possible to set it up Terminator after like 5 hi there is that okay okay and someone else the furnace is that it "
1119,"737062868.0","and someone else or furnace "
1120,"737062868.0","smile drinking alright I'm on there as soon as possible to set it up Terminator after after like 5 or so okay sorry I'll see you soon okay hi there is that okay what time do okay and someone else the furnace okay Q "
1121,"737062868.0","speaking to make you smile wrinkly alright I'm around if possible Domino's after like 5 hi there is that okay you after meeting okay and someone else okay cute "
1122,"737762383.0","I will not let them know "
1123,"737762383.0","I'm on how are you you are okay one thing and phone number I will let them know alright thanks "
1124,"737762383.0","Memorial Funeral Home in London how are you Park Road for parking 3770 thank you bye "
1125,"737762383.0","Memorial Funeral Home in London how are you I'm in looking at one of our life Park Road for hockey 3770 thank you "
1126,"737762383.0","I'm on how are you you are okay one thing and phone number I will let them know alright thanks "
1127,"737762383.0","Memorial Funeral Home in London available Park Road for parking 3770 thank you "
1128,"738455871.0","no problems no migraines Strasburg you're on hello my car inspections for tomorrow we've got someone to be forever first available for us Charles sorry I do have Thursday afternoon or Friday that would be are you fucking alright bye bye "
1129,"738455871.0","hypocrisy no problem there will now Walgreens Strasburg you're on hi Cara peckens tomorrow now we when we got some of the never first available for us sorry I do have Thursday afternoon or Friday okay that would be looking for alright bye bye "
1130,"738455871.0","set up an appointment for someone to come in and we're reaching Alexis it's opened up an appointment for someone to come out and 519 Green Boulevard so are en e l e r Colonel child Devon careful area intelligently take care 12074 we are we're just have a couple of a circle okay if you're not happening okay okay perfect bye bye "
1131,"738455871.0","carpet problem now Strasburg you're on right over my car inspected tomorrow now see when we got someone available whenever first available for us I do have Thursday afternoon available or Friday okay that would be alright "
