"Unique Id","Call Id","Words"
900,"727813830.0","Burns okay no problem Chris a call and we'll get someone out there soon your furnace to work are you cleaning okay are you are home protection alright have a good alright so that has a pool table room does that work let's take a look on Thursday call in the morning at my email you love you bye "
901,"727813830.0","yes to make it bye to the ferns okay no problem furnace is not working alright are you having for dinner you are home alright Burger are you some referrals of people who does that work I'm first I was looking for Thursday morning cuz it's already have something call in the morning let you know where you love you bye alright bye bye "
902,"727813830.0","yes to make a smile Burns okay no problem furnace is not working alright are you are home protection RIT Calendar sorry for the castle pool tables that's occurred Harris gay ice cream on Thursday I was looking for Thursday morning cuz it's already have some PCS "
903,"727813830.0","impersonal "
904,"727813830.0","Arias trial does it burn okay okay no problem I can take a call and then someone out there to see furnaces are you are home protection alright have a good somewhere cuz I also think what we have does that work exclamation let's take her on Thursday does it work I was looking for Thursday morning cuz I think we already have something I guess call in the morning at my email you love you bye "
905,"727813830.0","Maria speak it bye The Firm okay no problem are you having a nice you are home Erica alright from the castle pool tables does that work Sacramento I'm posting I was looking for Thursday morning cuz it's already "
906,"727857324.0","no problem if I could schedule so am I know we are booking into 20 23rd I don't have Monday Tuesday as well so so when are we can go to the following time that's better for you or okay I will have someone at 10 o'clock when our technician how to confirm you when we will come in fasting bye "
907,"727857324.0","no problem alright so I know we are booking into 20 23rd don't have Monday Tuesday as well or we can go to the store time that's better for you or okay no problem I will have someone at 10 o'clock when our technicians arrival will call you confirm you when we will come will be contacting "
908,"727857324.0","dial no problem alright so I know we are booking into 23rd I don't have money okay that's better for you or okay no problem I will have someone at 10 o'clock when our technician will be arriving how to confirm you when we will come in fasting bye "
909,"727857324.0","dial phone number alright so I know we are booking into 23rd that's better for you or okay no problem I will have someone at 10 o'clock when our technician will be arriving how to confirm you when we will come in the car battery "
910,"727857324.0","no problem so I know we are booking into permanent senior 23rd I don't have money so when are we can go to the following that's better for you or okay no problem I will have someone at 10 o'clock when our technician will call you confirm you when we will come will be contacting bye "
911,"727857324.0","no problem phone number I know we are booking into permanent store okay 20 23rd don't have money that's better for you or okay no problem I will have someone else you by 10 o'clock when our technician will be arriving how do you confirm you when we will come will be contacting "
912,"727950526.0","yes I was supposed to get a call back I think "
913,"727950526.0","I'm calling a part of service 802 weeks ago my name is Ray our E Eh 189 how much is screen or whatever the on your main yes I was supposed to get a call back when I call okay "
914,"727950526.0","I'm calling a part of service 802 weeks ago my name is Ray our E Eh 189 how much is screen off or whatever the yes I was supposed to get a call back on okay "
915,"727950526.0","tiger support together "
916,"727950526.0","yes I was supposed to get "
917,"727950526.0","I'm calling about 802 weeks ago my name is Ray our E Eh 189 how much how many call me bye good morning screen on the bus wherever yes I was supposed to get a call back okay alright "
918,"728164149.0","do you got my phone number "
919,"728164149.0","car make sure you got my phone number "
920,"728164149.0","I'm not fucking power "
921,"728164149.0","do you got my phone number "
922,"728164149.0","my phone number "
923,"728164149.0","I make sure you got my phone number "
924,"728167925.0","Chris I found your company I trying to find I need to get 3 estimates from companies that would be electrical projects I'm going my call I found some access to my condo it's on my bathrooms in the kitchen alarm so that work hi Sarah with the regional okay cool they call you I did 919 9131 where is that's perfect work early in the morning morning after 10 a.m. yes before your health care have a good day okay "
925,"728167925.0","Chris I found your company I trying to find I need to get 3 estimates from companies that would be electrical where I'm going complicated my call I found some accessibility my condo and I'm not it's on my bathrooms in the kitchen fire alarm hi Sarah with the regional okay cool I call you I think I'm ready first of all okay Byron Road 56 919-9131 yes where I am work early in the morning morning after 10 a.m. yes that's awesome for your health care have a good day okay "
926,"728167925.0","I found you are trying to find I need to get 3 estimates from companies that would be so electrical projects my call I found some access to my condo it's on my bathroom in my kitchen alarm hi Jim for the reason okay cool if I call you already I did 56 phone number cuz I'm working 919-9131 yes where I am that's perfect work early in the morning morning or after 10 yep that's awesome for your health care have a good day thank you okay "
927,"728167925.0","I trying to find I need some companies that would be electrical complicated Michael has access to my condo it's on my bathrooms in the kitchen fire alarm so hi Sarah okay cool they call you already phone number cuz I work off one 9 9131 yes where I am work early in the morning morning Dr camp for your health care have a good day thank you okay "
928,"728167925.0","Chris I found your company I trying to find I need to get 3 estimates from companies that would be so electrical projects accomplish my call I found some accessibility to my condo I'm working 3 to 3 this is not a threat it's on my bathrooms in the kitchen fire alarm hi Sarah with the region if I call you already I did 56 phone number cuz I'm working one 9 9131 where is CVS perfect work early in the morning morning like after 10 for your health care have a good day "
929,"728167925.0","Chris I found your company trying to find I need to get 3 estimates from companies that would electrical projects program my call I found a Nexus of my condo it's on my bathrooms in the kitchen alarm Hi Sam for the region they call you already I did 919 9131 yes where I am work early in the morning for your health care have a good day okay "
930,"728297107.0","how come okay you're welcome "
931,"728297107.0","is Oliver and I am calling from consultus also to camera inspection for municipal services okay and are 2500 years of material to get inspected and that's fine or I can our face heart okay and this before like 25/2 kilometers of Jim camera and the cost that may need to be cleaned or something out on hold for you said she's going to put me on hold for transferring me Google Hangout ality attend Center I'm looking for a ticket open camera inspection of 2500 meters does Han care sir and I was told I was $271 okay and but there I was wondering if it would be a good time for for cleaning beforehand okay thank you very much "
932,"728297107.0","Oliver I am calling from consultus also to camera inspection for municipal services okay and 2500 to get inspected okay that's fine or I can okay I'm glad at the for like 20 like 2/2 kilometers of zoom camera and other deposit therapy cleans for him or something out with you cos you said she's going to put me on hold for transferring me when people make pallet of town center I'm looking for to get with Jim camera inspection of 2500 meters of Hank are store our store hours $271 okay and but they were I was wondering if it would be a good time for for cleaning beforehand okay thank you very much "
933,"728297107.0","how come how you doing sexy you're welcome "
934,"728297107.0","possibly you're welcome "
935,"728297107.0","My Name is Oliver and I am calling from consultus also to camera inspection for municipal services okay and 2502 okay that's fine or I can face time Mr for like 25 to 1/2 kilometers of Jim camera and the topic that may need to be cleaned for me or something out with the car I hope this she's going to put me on hold answering me personality attend Center I'm looking for to get a zoom camera inspection of 2500 meters of same care sir our store hours $271 okay and nothing I was wondering if it would be additional car or for cleaning beforehand okay "
936,"728304677.0","morning for the morning "
937,"728304677.0","find service plan I'm wrong would you be able to check your records there g o u 65 Miller Road inserts key right now I'm not someone come out and service the furnace and look at it or whatever I mean that room right yeah debated a look at the air conditioners well or they just do the furnace or what what happened if you would Yahoo you know I can I can see what you have there very pretty it's 9:10 o'clock on the 18th okay yeah something on Friday November 2nd Friday the 2nd okay thank you very much "
938,"728304677.0","we could probably Friday this afternoon "
939,"728304677.0","morning for the morning "
940,"728304677.0","Vine service plan I'm wrong and when would you be able to check your records there g o u d y 1465 Miller Road West inserts key someone come out and service the furnace and look at it or whatever under that plan right yep no debate today look at the air conditioner as well or they just do the furnace or what what happens then okay yeah if you would be I would you know I can I see what you have there very City parent Lee they just 11 o'clock on the 24th at 9:10 o'clock on the 18th okay that's fine just like gas company on Friday November 2nd okay thank you very much "
941,"728304677.0","Vine service plan I'm wrong and when would you be able to check your records there g o u 14650 Commerce Road inserts key someone come out and service the furniture look at it or whatever I'm do that room right yep no debate today look at the air conditioner as well or they just do the furnace or what and what happens then okay maybe yeah if you would Yahoo what you know see what you have there for her period City Benson on the 24th I just o'clock on the 24th at 9:10 o'clock on the 18th okay yeah something on Friday November 2nd Friday the 2nd okay "
942,"728429953.0","no problem just take it to your place before set up an appointment someone will come over and go and go over that with you thanks about 1 you are okay compatible that's best for you you know our first available for our efficiency I can next Friday I've got availability for asking for second of herpes okay I will put that out real late morning on Monday I will see you then thank you have a good day bye bye "
943,"728429953.0","have a good day "
944,"728429953.0","well I hi good lighting is now Guild for my son go sounds great two places where I know they would work and the life my guitar 3 PC 475 Humphrey Avenue London or Out in Oak Ridge l m KLM 3 one word Walmart hi that's the easiest way to get to it if you come after I do have to drive through the subdivision which is a bitch confusing that's cool too hard enough 519-472-9835 you could use my first name that would be the 90 it's not on my calendar good morning with the Moines YouTube bye bye "
945,"728429953.0","no problem just take everything for your face someone will come over and go and go over that with you thanks forgot one you are okay compatible purple that's for you know our first available for our system expired available for asking for good morning have a good day bye bye "
946,"728429953.0","no problem set appointment someone will come over and and go over that with you have okay or not work okay compatible purple for you you know our first available for our system Friday I've got availability are you asking for good morning have a good day bye bye "
947,"728429953.0","no problem just take off we can set up an appointment someone will come over and go over that with you have purple okay or not work okay are compatible debt purple that's best for you you know our first available for our efficiency next Friday I've got availability laughing for second of herpes okay I will put that out and make more money you have a good day bye bye "
948,"729275533.0","okay bye "
949,"729275533.0","are you taking him make a smile oh okay so it's the bathtub okay phone number +51-965-950-1077 so are you are Charlie to come back I don't have anybody available for Tiffany Hart you Thursday okay awesome comma Department give you a call back 4 to recording New York be going to matter what "
950,"729275533.0","Maria speaking how can I make a smile oh okay so it's the bath tub girl okay phone number +51-965-951-0077 so are we're off for Charlie to come back I don't have anybody available for Tiffany heart is Thursday the first available everywhere else okay yeah okay awesome give you a call back 42 accordingly okay but we'll get you going about or whatever "
951,"729275533.0","breaker if they came home a flyer Subaru oh okay so it's the bath tub girl okay phone number +51-965-951-0779 so are we're off for Charlie to come back I don't have anything available for Thursday the 1st okay yeah okay no awesome comma Department give you a call back or what Papa "
952,"729275533.0","how far from the top of my daughter Colcord okay bye "
953,"729275533.0","Maria speaking from make a smile oh okay so it's the bath tub girl okay phone number +51-965-950-1077 so are we're off for Charlie to come back I don't have anybody available for pick apart be Thursday the 1st okay okay oh okay awesome comma Department give you a call back 452 accordingly okay that will get me going to matter what they are okay thank you bye bye "
954,"729587405.0","animal call you connect tonight I'm an exact time okay "
955,"729587405.0","how can help sorry I cannot hear you your house looking for you here okay as far as normal service your furnace conditioner okay that's all hello Carla Edwards no problem at all since he's there for sure so I will trying to see what he says that freedom back silly I only have available for the after work okay Tony over everything comma will call you tonight tonight I'm going to have time okay "
956,"729587405.0","comma will call you to make tonight on x.com okay "
957,"729587405.0","comma will call you to make tonight I'm in fact I'm okay "
958,"729587405.0","Mr Perry karaoke bar and 4th Avenue have come out here before I might be having a problem how was it yeah she came in London right off of restaurants 6 I'm here before so do you think somebody would be able to come this morning Norma Perry so animals coming here are Ry home protection plan I don't understand I have no we pay people come it's funny slightly for Monday so just an annoying like think like half don't know whether so hot or cold but it is this the teeny tiny I hear this when I called it a bad when I come back I notice you drop the card I thought maybe when the person is here they would be about 6 that would be fun are you Marie this afternoon okay creamer okay bye "
959,"729587405.0","Larry Kernel forms and 4th Avenue camaraderie floor and we having a problem however this yeah it came in London blew right off the restaurant so you think somebody would be able to come this morning Norma Perry we also as for me when you're here r r y home protected per I don't understand all I have no we pay people come just an annoying little like I'm calling you half the weather so hot or cold it is this the real tiny I hear this like when I go to the back when I come back hi I thought maybe when the person is here they would be able to fix that as well okay sure that would be fine okay I mean Visa yeah okay so that would be fine I'll stay when he gets here okay I'm home I Maria okay with your Marisol somebody this afternoon okay thank you very much okay bye "
960,"729623303.0","okay "
961,"729623303.0","bye bye "
962,"729623303.0","it's great where are you at home protection no problem Mary Mick mccurrey phone number for 1/2 pornography Mr Calisi 943-384-4488 okay work number perfect so I will November for maintenance here which is the Friday I have a spot available no problem at all we can move prefer morning or afternoon and I will I will put it in my family "
963,"729623303.0","484-4418 okay it's at 519-327-5714 472 earlier okay person okay "
964,"729623303.0","434-844-4103 okay it's 851-965-2327 okay 714 472 earlier okay okay "
965,"729623303.0","where are you at home protection okay no problem Mary Nick McGrady phone number so I have 4 numbers here this is 943-8444 a fax work number perfect so I will November for maintenances which is the Friday I have a spot available problem at all we can move it prefer mornings or afternoons and I will I will put it in my contacts "
966,"729650216.0","okay "
967,"729650216.0","okay "
968,"729650216.0","alright "
969,"729650216.0","okay "
970,"729650216.0","okay thank you "
971,"729650216.0","okay thank you "
972,"730374194.0","hi back at 5 Peter up to get internet here it's Roger I got Roger harmful okay listen green label containers coming in that'll interrupt isn't on it does it already you more apparently they need to be plugged into the wall I'm here in Oakland okay okay thanks bye "
973,"730374194.0","after you're up to get internet this is it right here phone Rogers at Rogers harmful okay litter listen label containers coming in that'll interrupted at home does it sooner already you more apparently they need to be plugged into the wall tomorrow I'm here in Orem okay okay thanks bye "
974,"730374194.0","hi Outlet a computer up to get internet here Roger Roger harmful okay litter they said no sleep green label since it is coming in that'll interrupted that home does it sooner already you more apparently they need to be plugged into the wall tomorrow tomorrow I'm here until 1 okay thanks bye "
975,"730374194.0","electrical Pathfinder up to get internet Roger Roger purpose okay litter they said no sleep what planes label cuz it's coming in that'll interrupted that home does it sooner already good more apparently they need to be plugged into the wall tomorrow forgotten tomorrow I'm here until 1 okay thanks bye "
976,"730374194.0","extra computer up to get internet this is a raider it's Roger I got Rogers harmful okay label Nike girl containers coming in that'll interrupted at home visits already good more apparently they need to be plugged into the wall mark I'm here in Orem okay thanks bye "
977,"730374194.0","hi you to an outlet electric at 5 direct to get internet it's Roger I got Roger harmful litter they said no sleep green label cuz the internet's Korean that'll interrupted at home visits already you more apparently they need to be plugged into the wall tomorrow forgot tomorrow I'm here until 1 okay like later than 4 okay thanks okay bye "
978,"730973505.0","Jackie Moran last week to fix our water and another time 226-663-3570 okay okay "
979,"730973505.0","Jackie met last week to fix our water and eating another time I miss you 663-3570 okay "
980,"730973505.0","Jackie met last week to our water isn't working another time my home number I'm home it's 226-663-3570 okay "
981,"730973505.0","Jackie met last week to fix our water and heating this isn't working so I hope it's not ignoring me 226-663-3570 okay "
982,"730973505.0","Jackie Moran last week to fix our water and Heating another time 63350 okay okay "
983,"730973505.0","Jackie Matt Marin last week to fix our water and heating this isn't working another time 226-663-3570 okay okay "
984,"731004414.0","service Maria speaking how to make a smile alright no problem we just remember 9843 now we are booking into I can get her in for the week or anytime or alright I will call you back perfect okay bye "
985,"731004414.0","no problem just remember now we are booking into I can go in for the week or or afternoon perfect okay bye "
986,"731004414.0","alright no problem let me just remember 9843 now we are booking into I can go in for the week of November 6th anytime or this afternoon when I can put it in the notes and someone will love to do that thing on when exactly debit card okay alright I will put it perfect okay bye "
987,"731004414.0","no problem it would just remember 9843 now we are booking into I can get you in for the week of November 6th anytime afternoon I can put it in the notes and someone perfect okay bye "
988,"731004414.0","alright no problem but we just remember now we are booking into I can go plan for the week of November 6th anytime brown or alright perfect okay bye "
989,"731004414.0","alright no problem just remember now we are booking into I can get her in for the week of November 6th anytime or perfect okay bye "
990,"731114439.0","speaking how can I make a smile whatever you are hey 11441 okay no problem okay you are aware we do I feel like she needs any straight to give us a call I do have 20 of 4 on Wednesday afternoon well that's a bad thing so comma then go ahead with repairs in my he's not able to accept cash check Visa or MasterCard thank you alright good morning no problem finding the morning I have to leave by 5 perfect thank you "
991,"731114439.0","smile the toilet whatever you are 1140 we come out and do a maintenance on your furnace okay no problem okay okay we were away all week so she needs any case give us a call you have 20 hours or for more afternoon so comma single price then go ahead with repairs in my he's not able to accept cash check Visa or MasterCard Wilson thank you alright good morning no problem finding the morning I have to leave by 5 so perfect thank you "
992,"731114439.0","problem for her find us on the spot and I put that in the notes that you one morning and you have to leave by 5 so "
993,"731114439.0","no problem finding morning I have to leave by 5 "
994,"731114439.0","perfect thank you "
995,"731114439.0","smile whatever you are hey 1140 me come out and do a maintenance on your furnace or okay okay no problem okay okay you are aware we do she needs to meet Grace give us a call I do have Tony available for our Wednesday afternoon purpose for everything with you give me the right price then go ahead with repairs in my he's not able to accept cash check Visa or Mastercard thank you problem for her find us on the spot and I put that in the notes that you one morning and have to leave by 5 so perfect thank you "
996,"731232888.0","say it wasn't alright this is okay alright is on the way we have right for looking for one thing it wasn't able to come tomorrow I can give you a call let me know bye I'll give you a call on Wednesday morning as well so around what time he'll be able to talk that's alright see you bye "
997,"731232888.0","wasn't phone number 519-471-3744 okay service schedule we have Wednesday right for looking for and see if it wasn't if we're able to come tomorrow I can give you a call I'll give you a call on Wednesday morning as well to let me know around what time he'll be able to come that's alright "
998,"731232888.0","where you have it say it wasn't alright bye alright and security phone number 511 right for looking for one thing if we're able to come tomorrow I can give you a call I'll give you a call on Wednesday morning as well around what time he'll be able to talk that's alright "
999,"731232888.0","give you a call this morning "
1000,"731232888.0","what you have say it wasn't alright you have your services before okay alright phone number 519-471-3744 flowers on the way right for looking for and see if it wasn't if we're able to come tomorrow I can give you a call I'll give you a call on Wednesday morning as well around what time he'll be able to that's alright "
1001,"731232888.0","what are you having to say it wasn't alright you have Services okay bye alright phone number 519-471-3744 cancel or reschedule right for looking for one see if you can go see if we're able to come tomorrow I can give you a call to let you know give you a call on Wednesday morning as well around what time "
1002,"731485173.0","thank you "
1003,"731485173.0","thank you "
1004,"731485173.0","thank you "
1005,"731485173.0","thank you "
1006,"731485173.0","Thursday "
1007,"731485173.0","thank you "
1008,"731618763.0","I am pretty sure last time you were here we used to credit card "
1009,"731618763.0","I am pretty sure last time you were here we used to credit card now "
1010,"731618763.0","I am pretty sure last time you were here we used to credit card "
1011,"731618763.0","credit "
1012,"731618763.0","I am pretty sure last time you were here we used to credit card "
1013,"731618763.0","I am pretty sure last time you were here we used to credit card "
1014,"731657618.0","what you're speaking is Jon Surfs now 7228 Lloyd I'm calling them yes some of the stores and II Street "
1015,"731657618.0","what you're speaking is Jon Surfs no 7228 Lloyd I'm calling them yes some of the stores and they have America's Best 2nd Street "
1016,"731657618.0","what you're speaking is Jon Surfs no 7228 Lloyd I'm calling them yes some of the stores and they are 2nd Street "
1017,"731657618.0","what you're speaking is Jon Surfs no 7228 Lloyd I'm calling them yes some of the stores and they have the generic filters West 2nd Street "
1018,"731657618.0","what you're speaking is Jon Surfs now 7228 Lloyd I'm calling them some of the stores and 2nd Street "
