"Unique Id","Call Id","Words"
683,"712023794.0","no so there's water coming from the Wall Street Undertaker wife prior okay okay for Life gone Baden okay I'll go in here it for the many ways call going here in system exclamation I would not lie come home okay okay can you give me a call I was the best number to you and I forgot that we 9 902-0649 okay I will put it in the notes and I will have all later on give you a call or you call me we can have someone stop by and check it out make sure everything is okay there okay alright "
684,"712397013.0","hi I am just wondering if I could talk to Martha is available networking group with her nose networking okay girl our air conditioner broke a couple weeks ago like spend $700 has it again on Friday wondering if you come give us a quote and then I remembered our Network definition I just want to start thank you Friday and then our basement flooded yesterday fantastic week at our house sexy part of following Friday in Lincoln I don't know if that makes a difference in terms of make it harder okay what is the normal like a just on average our air conditioner run okay okay okay okay okay Victoria Palmer PA lmer s perfect Avenue 509 639 4967 Victoria Homer at home inspect.com yeah okay sounds good okay thanks okay bye "
685,"712397013.0","hi I am just wondering if I could talk to Martha is available networking group with her nose okay girl our air conditioner broke a couple weeks ago why like spent $700 now we're hasn't day it could be a month a couple weeks couple weeks wondering I have to think about if you come give us a quote and then I remembered our Network definition I guess I record Friday and then our basement started yesterday a fantastic week at our house next week part of following Friday in Lucan I don't know if that makes a difference in terms of order what is the normal like a just on average our air conditioner run okay okay okay okay what's his name okay Victoria it's a lmar perfect Avenue 5.9 639 4967 Sarah Victoria summer at homeinstead.com yeah yep it's meeting for women okay sounds good okay thanks okay bye "
686,"712397013.0","okay sounds good okay thanks okay bye "
687,"712397013.0","hi I am just wondering if I could talk to Martha is available networking group with her nose okay breakfast meeting for women networking group reason why your ass up okay girl our air conditioner broke a couple weeks ago like spend $700 has it fix it could be a couple weeks I have to think about if you come give us a quote and then I remembered our networking group conditioning I guess I record thank you I never basement Furniture day have a fantastic week at our house part of following Friday in Lucan I don't know her difference in terms of the artists what is the normal like a just on average our hair conditioner run okay okay okay okay what's his name okay Victoria Calmar klma are perfect 509 639 4967 Sarah Victoria summer at home inspect.com yeah yep it's meeting for women okay sounds good okay thanks okay bye "
688,"712397013.0","hi I am just wondering if I could talk to Martha is available networking group with her you know breakfast meeting for women networking group girl our air conditioner broke like spend $700 has it it could be a couple of weeks couple weeks just wondering I have to think about you can come give us a quote and then I remembered our Network definition I guess I record thank you Friday and then our basement Furniture day a fantastic week at our house so I don't know how to following Friday in this can I don't know if that makes a difference in terms of make it harder okay what is the normal like I just whenever that air conditioner run okay okay okay okay okay okay Victoria Commerce PA lmer perfect Avenue 509 639 4967 Victoria Omer at home inspect.com yeah Anthony yep it's meeting for women okay sounds good okay thanks okay bye "
689,"712397013.0","hi I am just wondering if I could talk to Martha is available networking group with her nose okay breakfast meeting for women networking group reason why you're with us okay girl our air conditioner broke a couple weeks ago like spend $700 how's it going on Friday I could be a couple weeks wondering I would have to think about come give us a call and our Network I heard I never basement started yesterday perfect at our house so I don't know yeah how the following Friday in this can I don't know if that makes a difference in terms of make it harder okay what is the normal like I just on a virgin air conditioner run okay okay okay okay what's his name Sun okay Victoria it's a lmar perfect 154 yes sir Avenue 509 639 4967 for Victoria okay sounds good okay thanks okay bye "
690,"713205134.0","okay I'm not sure you have the work waiting for the day her coworkers "
691,"713205134.0","okay you have to work waiting for the day her to go whenever I will have her come "
692,"713205134.0","okay I'm not sure I'll pass it on to Chris because I have to work late for her to go home "
693,"713205134.0","okay I'm not sure I have to work late for the day hopefully I will have heard from a lot "
694,"713205134.0","bye "
695,"713205134.0","yeah are you hoping your way okay I'm not sure if it's because you have to work late for her to go with her thanks bye "
696,"713234719.0","answer "
697,"713234719.0","answer "
698,"713234719.0","answer "
699,"713234719.0","finishing off my loss showing up at my house "
700,"713234719.0","answer "
701,"713234719.0","finishing off my way to get my house "
702,"713275788.0","I can do a 10 o'clock appointment "
703,"713275788.0","perfect "
704,"713275788.0","welcome to 10 o'clock appointment with all your heart "
705,"713275788.0","the 16th I can do a 10 o'clock appointment with at work "
706,"713275788.0","I think I can do a 10 o'clock appointment with us "
707,"713275788.0","dial person could have someone come no problem okay no problem hi there sorry about that so a her compass okay I think I can do a 10 o'clock appointment with at work perfect "
708,"713932142.0","waterfall the Warren if you're wearing John Tang there were some other parts and warm to confirm oh my gosh call me or when she even if I don't program for you guys anything Sorry my phone's been a little crazy yeah I'm here break in talking a warranty thing that's out for like to go if you guys have going on we are not home we want you guys are available go Friday short notice Harlem Park Drive in Berkeley to happen to be in the afternoon I wouldn't be terrible go to be home until 1 o'clock is breaking up hello 7 calendar makeover I'm not lying to you last night Ry find or Miss Verna cookies brownies bed hope you get better 1520 foot table yeah I'll be home by 1:00 I or and so how do we work out there is the way "
709,"713932142.0","for Warren Johnson your work another person I wanted to confirm oh my gosh you tell me or when she even if I don't program for you guys anything Sorry my phone's been a little crazy yeah I'm here alright that's it in turn your warranty thing that's fantastic we're good to go if you can turn the phone off are not home don't want you guys are available go Friday kind of short notice tomorrow then possible cuz I'm hard to happen to be in the afternoon I wouldn't be terrible to be home until 1 o'clock breaking up double check my calendar but I'm not lying to my mom's car last names 8 our why ER find internet working Sunnyside hold together 1520 foot table yeah I'll be home by 1:00 random so how do we work out there is the way "
710,"713932142.0","waterfall under warranty if you're wearing drunk and your work another person wanted to confirm oh my gosh call me or when she even if I don't program for you guys anything Sorry my phone's been a little crazy yeah I'm here alright that's it in touch in your warranty thing or like to go if you can't answer the phone on are not home don't want you guys are available go Friday I'm short notice tomorrow Impossible trailer to happen to be in the afternoon I wouldn't be terrible to be home until 1:00 right double checking calendar makeover I'm not Ryan T last name r y find or Miss Verna cookies brownies bed hope you get better 1520 foot table yeah I'll be home by 1:00 random so how do we work out period so there "
711,"713932142.0","your warranty if you're wearing Johnson can you work another person I wanted to confirm you told me or when she even if I don't I will be in the program for you guys anything Sorry my phone's been a little crazy yeah I'm here Greg Pepe in talking a warranty thing that's fantastic we're good to go if you can turn the phone off we are not home I want you guys are available go Friday I'm short notice tomorrow possible problem to happen to be in the Illinois I wouldn't be terrible to be home until 1 o'clock wake up double check my calendar makeover I'm not lying to my mom's car last name r y e r Define door it's Verna cookies brownies bed hope you get better 15620 portable I'll be home by 1:00 hello random so how do we work out period so there "
712,"713932142.0","yeah I just for Warren Johnson your work another part for it wanted to confirm call me or when she even if I don't program for you guys anything Sorry my phone's been a little crazy yeah I'm here break in parking your warranty thing or would like to go with me or if you're going to plan on are not home don't want you guys are available Friday I'm short notice tomorrow possible problem our to happen to be annoying think I wouldn't be a terrible go to be home until 1:00 right now double check my calendar makeover I'm not lying to you last night Ry find Macy's furniture confirming day I hope you get better 1520 purple tie blah blah I'll be home by 1:00 random so how do we work out there is the way "
713,"713932142.0","random so how do we work out period so there "
714,"714135791.0","go over everything going to cash check Visa MasterCard I will have a bad "
715,"714135791.0","we'll go over everything cash check Visa MasterCard I will have "
716,"714135791.0","coming on I don't like her images back in a call going here and how we've been to your place before yeah what's the warranties are on available are you morning so have them our dispatch Department give you a call back on when you're not available morning yeah put it in the in the notes here and I will have on our dispatch Department give you a call back with an exact time when he will arrive okay we'll go over everything except cash checks Visa MasterCard I will have a dispatch "
717,"714135791.0","go over everything Visa MasterCard I will have a good day "
718,"714135791.0","we'll go over everything XXX he's a MasterCard I love you I will have a fax "
719,"714135791.0","take me to 1825 criminal matter problem images that get a call going here and how we've been to your place before 1982 yeah what's the warranties are on available are you available morning so have them our dispatch Department give you a call back on when you're not available this morning hey put it in the notes here and I will have on our dispatch Department give you a call back with an exact time when he will arrive okay go over everything cash check Visa Mastercard "
720,"714330484.0","alright I had a gentleman out for it I like to do anything the basement hurting my feelings drywall coming to do right wondering if we could meet where are like when they're doing the drywall 2008 34 Clarkson no ice cream okay okay we might be able to also make an appointment for him to come back why can't you just to finally put the right thing after they do the drywall drywall then go 263 days so I thought maybe you could turn everything 27th you know you gave me her okay alright give us to call back don't know how long okay okay then thank you "
721,"714330484.0","okay then thank you "
722,"714330484.0","okay then thank you "
723,"714330484.0","okay then thank you "
724,"714330484.0","okay well thank you "
725,"714330484.0","okay then thank you "
726,"715211668.0","okay "
727,"715211668.0","11 "
728,"715211668.0","9 + 11 "
729,"715211668.0","911 "
730,"715211668.0","9 + 11 "
731,"715211668.0","11 "
732,"715484516.0","right before information and we spend a set up an appointment and we can have someone come out and give you an accurate price okay hello Iraq Valley 470-3534 okay are you okay alright the first available aha tomorrow Wednesday so I can do Friday broke unless you have a cancelation I can certainly give you a call this semester okay so 12 10-4 okay press 3:00 that's it okay bye "
733,"715484516.0","and then we can set up an appointment and with Nick someone come out and give you an accurate price okay hello Valley 470-3534 let's go with us so I will will work our friends to come out the time are you okay alright her first available aha it's Mooresville Wednesday so I can do Friday unless you have a cancelation I can certainly give you a call just to make sure okay so we'll try 12 okay that's three of her that's it okay "
734,"715484516.0","right before send and we spend a set up an appointment I'm looking at someone come out and give you an accurate price okay hello practice Valley 449-470-3534 let's go with us okay are you okay alright the first available aha tomorrow Wednesday so I can do Friday so unless you have a cancelation I can certainly give you a call just to make sure okay so we'll for Friday 12 press 3:00 that's it okay "
735,"715484516.0","right before and then we can set up an appointment I'm with met someone come out and give you an accurate price okay so are Valley 470-3534 electric bill with us okay are you okay alright first available smart girl one that's described unless you have a cancelation I can certainly give you a call okay so Fridays 12 or 3 the 24 Okay it's 3 of her okay "
736,"715484516.0","and then we can set up an appointment and with net someone come out and give you an accurate price okay hello Valley 470-3534 let's go with us okay are you okay depending or it's not working alright first available laugh tomorrow Wednesday so I can do Friday unless you have a cancelation I can certainly give you a call listen if you're okay for Friday 12 24 press 3:00 that's it okay "
737,"715484516.0","and then we spend a set up an appointment I'm looking at someone come out and give you an accurate price okay hello what is wrong practice Valley 43534 okay I will work our phone are you okay 4.4 is not working okay alright her first available haha it's more as well Wednesday so I can do Friday unless you have a cancelation I can certainly give you a call this semester okay so we'll Fridays 12 24 press 3:00 okay "
738,"716038010.0","Mimi's mile earlier already saw it or condo and morning "
739,"716038010.0","Mimi's mile earlier already saw it or condo and morning "
740,"716038010.0","Mimi's mile earlier already so it for our condo and morning "
741,"716038010.0","Mimi's mile earlier already so it or our condo and morning "
742,"716038010.0","Mimi's mile earlier already saw it or condo and morning "
743,"716038010.0","hi "
744,"717323234.0","okay you have a great day YouTube bye bye "
745,"717323234.0","Channel reminder service I had a spare my name is Shelly sh e i SMA skype.com are continue really gmail.com we have sent a patio heater that's fine laundry room is where the furniture the password howdy Friday weather Friday okay you have a great day YouTube bye bye "
746,"717323234.0","Channel service my name is Shelly sh e LLY SMH skype.com are continue Gmail we sent out if you trust me that's fine laundry room is where the furniture the password Harley Friday weather Friday you have a great day bye bye "
747,"717323234.0","okay you have a great day you too bye bye "
748,"717323234.0","okay you have a great day you too bye bye "
749,"717323234.0","okay you have a great day YouTube bye bye "
750,"717515216.0","I'm calling because first of all it hello I guess we're gonna leave it see if we're going to watch the I was out of line at 1 Jones Drive so black has done for for a week or so or do we there was a question about a part or yeah tomorrow you know I'm not a problem there so if you work are you are sucking see now actually okay okay I'm you know would be yes okay you're not answering bye "
751,"717515216.0","I'm calling because first of all I guess we're gonna leave it see if we're going to have a line so would like to be there when when what is done for for a week or so ago there was a question about our tour yeah you know I'm or well the problem so yeah so if if it works okay alright are you are sucking see now actually okay okay I'm you know would be yes if you don't mind that would be more for 5 okay or not "
752,"717515216.0","I'm calling because first of all it hello I guess we're gonna leave it see if we're going to watch the I was out of line at 1 Jones Drive Burger so would like to be there when when flushes done for for a week or so ago there was a question about our tour yeah I work tomorrow you know I'm or well that's the problem so yeah so if if it works alright are you are sucking Tina Lu okay okay I'm you know would be yes I hope you don't mind that would be more okay for a nice spring break bye "
753,"717515216.0","I'm calling because first of all it camera I guess we're gonna leave it see if we're going to wash I was there I was online 21 at whenever yeah so I would like to be there when when what is done for for a week or so ago there was a question about a part or yeah I will be tomorrow you know I'm not a problem there so if you work okay alright are you are sucking see now actually okay okay I'm you know would be yes okay we're not pretty good bye "
754,"717515216.0","I'm calling because first of all I guess we're going to leave it if we're going to watch the house at 1 at 1 Jones Drive so would like to be there when when what is done for for a week or so ago there was a question about a part or yes I work tomorrow you know I'm or well the problem there so yeah so if you work are you are sucking Tina Lu okay okay I'm you know would be yes Oprah prefer "
755,"717515216.0","I'm calling because first of all it hello I guess I don't need it so we're going to watch the house at 1 21 at 1 x drive this matter so what is done for for a week or so ago there was a question about our tour yeah I work tomorrow you know I'm not sure what the problem there Friday so yeah so if you work or something Tina true okay okay I'm you know would be yes if you don't mind that would be more 645 okay or not bye "
756,"717775130.0","morning finding home purpose John speaking okay uncle alright likely apart a problem our perm Direct on the phone right now let me give you a call back in the next few minutes are you available in the next half hour okay the phone number is best for you 75 okay alright I will have her I'm going to give you a shout back in the next half hour take care bye bye "
757,"717775130.0","morning finding home purpose John speaking okay okay alright likely apart from our Pharmacy on the phone right now to give you a call back in the next few minutes or you're available okay phone number for you 75 alright little hard drive for me to get you here back in the next half hour take care bye bye "
758,"717775130.0","morning finding home Curtis John speaking alright likely apart a problem our phone book on the phone right now let me give you a call back in the next few minutes or you're available in the next half hour phone number for you 75 alright well have fun to hear back in the next half hour "
759,"717775130.0","morning finding home Curtis Jones okay alright likely apart problem our permit booklet on the phone right now give me a call back in the next few are you available tomorrow phone number for you 75 alright well have fun to get you here back in the next half hour take care bye bye "
760,"717775130.0","morning fine at home Curtis Jones okay alright likely apart a problem our perm Direct on the phone right now to give you a call back in the next few minutes are you available in the next half hour okay what's the phone number is best for you 75 alright I will have her I'm going to give you a shout back in the next half hour take care bye bye "
761,"717775130.0","morning finding home Curtis Jones okay okay alright likely apart problem our permit booklet Direct on the phone right now to give you a call back in the next few available times on our okay the phone number to step for you 75 alright I will have her coming to get your car back in the next half hour take care bye bye "
762,"717776187.0","Greenwood my service everything comes up oh my gosh 49105 look at the furnace an air conditioner whatever hello this pervasive "
763,"717776187.0","Greenwood I live I keep my service everything comes up something an hour my God 519-649-1056 at the furnace an air conditioner whatever hello this perfect "
764,"717776187.0","Greenwood 6 miles service everything comes up an hour my God 1056 whatever hello this that you serve basis "
765,"717776187.0","Greenwood I live I think my service everything comes up thanks an hour my point 519-649-1056 look at the furnace an air conditioner whatever hello this perfect "
766,"717776187.0","Greenwood I think my service Herman an hour 1056 whatever hello this "
767,"717776187.0","Greenwood I keep my service everything comes up thanks oh my God 519 for 91056 look at the furnace an air conditioner whatever hello this perfect "
768,"717835517.0","your no problem that would come with her Harper morning recorder concert "
769,"717835517.0","quarter "
770,"717835517.0","it works no problem not what comes what you had in mind or Harper morning work order 110 30 like most cruises child traffic you "
771,"717835517.0","traffic "
772,"717835517.0","no problem not what comes what you had for for more work order 110 30 like most cruises child traffic assist you "
773,"717835517.0","no problem weather armoire quarter after 10:30 like most cruises child traffic "
774,"718723924.0","furnace motor I am going to be at the focus this one if you could have her a service tech come out hello heart 840 519-686-0969 okay alright bye "
775,"718723924.0","furnace motor Champlin complete the focus if we could have our service tech come out Mills and my LLS 415 Hart 8:45 519-686-0969 alright bye "
776,"718723924.0","furnace motor Jim going to be at the focus if we could have our service tech come out Mills and my LLS 415 Hart 843 press 519-686-0969 alright bye "
777,"718723924.0","furnace motor Jim going to be at the focus if we could have our service tech come out Mills and my LLS 415 Hart 842 press 519-686-0969 alright bye "
778,"718723924.0","Services your call is important to us Moline okay "
779,"718723924.0","furnace motor Jim going to be at the focus if we could have our service tech come out Mi LL ER 415 Hart 8:40 press 519-686-0969 alright bye "
780,"720489779.0","94343 "
781,"720489779.0","94343 "
782,"720489779.0","94343 "
783,"720489779.0","94343 "
784,"720489779.0","94343 "
785,"720489779.0","94343 "
786,"720547577.0","okay Sturgess "
787,"720547577.0","okay good "
788,"720547577.0","okay very good "
789,"720547577.0","okay Sturgess "
790,"720547577.0","okay good "
791,"720547577.0","okay Sturgess "
792,"721154717.0","okay Kelly Barrington calling I'm following up on the electrical panel and irritated I'll be home tomorrow September Street 362 thank you "
793,"721154717.0","hi Doug Kelly Barrington calling I'm following up on I'll be home tomorrow September 651-973-8362 "
794,"721154717.0","hi Jennifer Kelly Barrington calling I'm following up on the electrical panel and irritated I'll be home tomorrow September 947-3362 thank you bye "
795,"721154717.0","hi Doug Kelly Barrington calling I'm following up on the electrical panel and irritated I'll be home tomorrow September 6th 9 for 3362 thank you "
796,"721154717.0","hi Doug Kelly Barrington calling I'm following up on the electrical panel and I'll be home tomorrow September 651-973-8362 thank you "
797,"721154717.0","hi Doug Kelly Barrington calling I'm following up on the electrical panel and I'll be home tomorrow September 651-973-8362 "
798,"721299255.0","voicemail is Annette "
799,"721299255.0","voicemail leave a mess "
800,"721299255.0","voicemail "
801,"721299255.0","broccoli "
802,"721299255.0","voicemail leave a message "
803,"721299255.0","voicemail we connect "
804,"721425258.0","Creek we have called the home protection plan you signed up for it if it is if you wanted for her furnace and air conditioning can have it on both units so if you wanted it on one of you it would be 9 a month if you want to it'll be 1397 a month plus pack of work you can paid by Monday so I'm out now plan you if you needed me or next week I'm out $59 so you save $0.04 off on the work phone as well if it works out cuz you come up with I support it's 119 plus tax efficient or 60 so okay all set for the type of insurance because it for your furnace and air conditioning only you don't ask for anything else but because we do offer plumbing and electrical services for Anna Smith and like I said if you were to come out you would save the dispatch it's fine with her modem remember which is $59 so you would come out we were waiting a single furnace okay how you know we were sugar okay yeah I know that the plan that we have like 4 and all the other companies in town that's what they mean you know it's pretty you know Service Plus 10% off on Google and Sons we were to come out for your burn as long as the routine maintenance have your parts and labor on your okay "
805,"721425258.0","yeah yeah the home warranty programs yeah I'm going to I can read most current so so I'm looking for on your furnace we are kind of sauce I don't know the whole Dollar Tree Service ever yeah no no I'm just calling yeah yeah "
806,"721425258.0","yeah at 4 "
807,"721425258.0","yes of course "
