"Unique Id","Call Id","Words"
600,"705736986.0","what's the furnace check repair Las Vegas okay I can do this week if you have your maybe Best Buy Kindle Store I get your email address and I can send it to me so that's David how to go doggies okay perfect I will send it to you okay comma bye bye "
601,"705736986.0","what's up license Equity furnace check repair Las Vegas okay I am to see if you have your a movie about bicycle through can I get your email address and I can send it to me yep perfect I will send it to you okay no problem bye bye "
602,"705736986.0","like furnace check repair Las Vegas okay I am to see if you have your maybe best bicycle store can I get your email address and I can send it to me but ice by savers okay perfect I will send it to you okay comma bye bye "
603,"705736986.0","what's up what's up like it's pretty furnace 2nd repair Las Vegas okay I can do this week if you have your maybe that's bicycle School get your email address and I can send it to you but that's my favorite how to go doggies okay perfect I will send it to you thanks comma bye bye "
604,"705736986.0","the furnace check repair Las Vegas okay I am to see if you have your ohh maybe about bicycle through I get your email address and I can send it to me yep perfect I will send it to you thanks comma bye bye "
605,"705736986.0","like furnace repair Las Vegas okay I can in to see if you have your movie about bicycle School I get your email address and I can send it to me but ice by Davison how to go dosskey okay perfect I will send it to you thanks comma bye bye "
606,"706146243.0","and your "
607,"706146243.0","and your email "
608,"706146243.0","and your "
609,"706146243.0","and your "
610,"706146243.0","show me a copy of watch "
611,"706146243.0","and your "
612,"706149854.0","good morning I'd like to have an electrician come in and install something sounds please Noah's Ark existing ceiling fan start just light fixtures Mr too big for the beginning of whether the adult of the boxes are drunk enough to hold the ceiling fans they're not they're not the normal ceiling fans there to groom on the left something on I took down one of the pictures and couldn't quite to him and weather was strong enough so I thought I needed some please don't like to NBA double Martin and May rtin is 500 8th Street pink team NFL contains between Maitland and Williams m v y creepy 33 Peter free is V 19667 646 my sister-in-law has used before So she recommends you okay I see so it's not 5 hours and how much am I normally how much does the ceiling fans cost to install okay when you say 125 hundred dogs okay okay okay that's fine good morning work for us now Stefan a tent works because oh sorry just corrected we have a daughter going to camp but transparent is taking her that morning so ever okay no that's fine thank you very much I'm just one more thing Realty give a ring before he comes Thursday Cisco to come in the morning okay thank you so much okay "
613,"706149854.0","good morning I'd like to have a electrician come in and install something sounds please Noah's Ark existing ceiling fans III just light fixtures Mr Leveque to determine right from the beginning is whether the of those those two boxes are strong enough to hold to ceiling fans they're not they're not enormous ceiling fans there for two bedroom unless it's something I took down one of the pictures and couldn't quite to him and weather was strong enough so that's all I needed some leave his electrician ramble Hari NBA Double L Martin and May rtin is 508 contains Street thinking and that's been changed between Maitland and Williams n v y creepy 33 Peter free is 500-9667 oh six four six my sister-in-law has Houston before So she recommends you okay I see how it's not by the hours and how much am I normally how much does the ceiling fans cost to install okay when you say 125 hundred dogs okay yeah okay okay that's fine good morning work for us yet Stephanie 10:30 works because oh sorry just corrected we have a dolphin going to camp but I'm friends Paradis taking her that morning so Google every no that's fine thank you very much ohh just once more thing Realty give a ring before he comes or is he just going to come in the morning okay thank you so much okay "
614,"706149854.0","good morning I'd like to have electrician come in and install something sounds please no dog existing ceiling fan star just light fixtures Waterbeds to determine right from the beginning as whether the of those of the boxes are strong enough to hold to ceiling fans but they're not they're not the normal ceiling fans there for two bedroom unless it's something on I took down one of the pictures and couldn't quite to him and weather was strong enough so I needed some he doesn't like Martin Martinez is 508 Main Street pink team and that's been changed between Maitland and Williams m v y creepy 33 Peter free is 500-9667 oh six four six my sister-in-law has used it before So she recommends you okay I see so it's not 5 hours and how much am I normally how much does the ceiling fans cost to install okay hundred okay okay that's fine Thursday morning work for us here stuff works because oh sorry just corrected we have a dolphin going to camp but I'm friends Paradis taking her that morning so ever okay no that's fine thank you very much just once more thing Realty give a ring before he comes Thursday just going to come in the morning okay okay "
615,"706149854.0","good morning I'd like to have electrician come in and install 10 ceiling fans please testing ceiling fans III just light fixtures Waterbeds to determine right from the beginning of whether the of those of the boxes are asking us to hold 2 ceiling fan of it they're not they're not the normal ceiling fans there for two rooms unless it's something on I took down one of the pictures and couldn't quite to him and weather was strong enough so that's all I needed some leave his own like to NBA Double L Martin and May rtin is 508 contains Street thinking and that's been changed between Maitland and Williams n v y creepy 33 Peter free is V 19667 646 my sister-in-law has used it before so okay I see so it's not 5 hours and how much am I normally how much does the ceiling fans cost to install Okay say 125 hundred dogs okay yeah okay okay that's fine Thursday morning work for a few hours stuff works because oh sorry just corrected we have a dolphin going to camp but I'm friends Paradis taking her that morning so ever okay no that's fine thank you very much just one more thing Realty give a ring before he comes or is he just going to come in the morning you're the first okay thank you so much okay "
616,"706149854.0","good morning I'd like to have a electrician come in and install 10 ceiling fans please dark existing ceiling fan starts at light fixtures Mr verbeck depart right from the beginning of whether the of those two boxes are strong enough to hold to ceiling fans but they're not they're not the normal ceiling fans there for two bedroom on the left something on I took down one of the pictures and couldn't quite to him and weather was strong enough so I thought I needed some Martin Tiana 508 Street painting and that's the essentials to clean Maitland and Williams n v y creepy 33 Peter free is V 19667 646 my sister-in-law has used it before so see you okay I see so it's not 5 hours and how much am I normally how much does the ceiling fans cost to install okay hundred okay okay that's fine good morning work for us now Stephanie 10:30 works because oh sorry just corrected we have a daughter going to camp but transparent is taking for that morning so whatever okay no that's fine thank you very much I'm just one more thing Realty give a ring before he comes Thursday Cisco to come in the morning okay okay "
617,"706149854.0","good morning I'd like to have a electrician come in and install something sounds please testing ceiling fans III just light fixtures I'm more bags on the beginning as whether the of those of the boxes are drunk enough to hold to ceiling fans enormous ceiling fans there to groom I left something on I took down one of the pictures and couldn't quite to him and weather was strong enough so I needed some leave his own like to a n d a w Martin and May rtin is 508 contains Street pink team and that's been changed between Maitland and Williams m v y creepy 33 Peter free is 500-9667 oh six four six my sister-in-law has Houston before so okay I see so it's not by the hours and how much am I normally how much does the ceiling fans cost to install okay so when you say 125 hundred dogs okay okay okay that's fine Thursday morning work for us here doesn't work because oh sorry just corrected we have a dolphin going to camp but I'm friends Paradis taking her that morning so whatever no that's fine thank you very much just one more thing Realty give a ring before he comes or is he just going to come in the morning okay thank you so much okay "
618,"706490920.0","intercourse "
619,"706490920.0","4219 "
620,"706490920.0","4219 "
621,"706490920.0","4219 "
622,"706490920.0","11 to 5 "
623,"706490920.0","11 to 1/4 "
624,"706828789.0","is Mark available Jen sorry I don't know her first name a herb Colin from Chorus radio and 2/8 this is so Sergio how are you conversing with Martha earlier this week about some outstanding invoices so I heard there is three outstanding I can either be at finding Home Services Thank you period dot calm or I will forward you this morning to you and it'll get to you never really Pharmacy Simpson it automatically says these are sent to me so I can as or add voice didn't have a we just had account February invoices that I'm just try to figure out so I just forwarded them to you already and I just I 7 to market yesterday that I just take it to me or if you're able to help me her yesterday so it's nothing now and you'll have them also so this weekend "
625,"706828789.0","is Mark available Jen sorry I don't know her first name a herb Taurus Radio 10 to 8 Sergio how are you conversing with Martha earlier this week about some outstanding invoice so I heard there is free outstanding in Home Services Thank you period dot calm I will forward these to order to you you never really made Pharmacy Simpson it automatically says these are sent to me so I can as or add voice didn't have a I just had account February invoices that I'm just try to clear up so I'll just forward against you you already our records indicate you have a baby I just tried 7 to Mark yesterday but I just think it to me or you're able to help me I sent her yesterday so shopping now and you'll have them also so sweet "
626,"706828789.0","is Mark available Jen sorry I don't know her first name a herb Taurus Radio 10 to 8 this is so hey Bo how are you conversing with Martha earlier this week about some outstanding voice so I heard there's three outstanding in February I can ever be a pain in Home Services thank you very dot calm I will forward these to you and it'll get to you never Pharmacy Simpson it automatically says these are sent to me so I can as or add voice didn't have a new dispatch account Burien horses said I'm just try to figure out so I just forwarded it to you already have a just a 7 to Mark yesterday but I just figured if you're able to help me her yesterday so it's nothing now and you'll have them also so "
627,"706828789.0","is Mark available again I'm sorry I don't know where first name Furby Taurus Radio 10 to 8 hello how are you conversing with Martha earlier this week about some outstanding invoices so I heard there's three outstanding in February I can either be at finding Home Services thank you very dot calm harm I will forward these to you and it'll get to you never Simpson it automatically says these are sent to so I can as or add voice didn't have a we just had account February invoices that I'm just try to clear up so I just forwarded you already our records indicate you have a good day I just tried 7 to Mark yesterday but I guess you could send me or you're able to help me you as well because I sent these invoices to her yesterday so it's nothing now and you'll have them also so this weekend "
628,"706828789.0","is Mark available Jen sorry I don't know her first name a herb chorus radio 10 to 8 single how are you conversing with Martha earlier this week about some outstanding invoice so I heard there is three outstanding in February I can be refining Home Services thank you very dot calm harm I will forward these to you and it'll get to you never really made their way Pharmacy Simpson it automatically says these are sent to so I can as or add voice didn't have a just had account February invoices that I'm just try to figure out so I just forwarded it to you already our records indicate you have a just a 7 to market yesterday that I just forwarded it to me or you able to help me because I sent these invoices to her yesterday so I'm stopping now and you'll have them also so this weekend "
629,"706828789.0","is Mark available Jen sorry I don't know where first name a herb chorus rainy 2/8 hello how are you conversing with Martha earlier this week about some outstanding invoice so I heard there is free outstanding and I can chat finding Home Services Thank you period dot calm I will forward these to this morning Gordon do you get to you I don't know never really made their way to your Simpson it automatically says these are sent to so I can as or add voice didn't have a just had account February invoices that I'm just try to clear up so I'll just forward this to you already our records indicate you have a good day I just tried 7 to Mark yesterday but I guess we could take or you're able to help me I sent her yesterday so shopping now and you'll have them also so sweet "
630,"708232806.0","hi part of the closing so that's 48402 long Mikey School how long of a job that's the only thing so I will what about Friday morning early afternoon for what he's coming for Ryan I can't remember you are a fucking break schedule so who's available Thursday afternoon it would be like a okay I can I will be coming back on the 31st bye bye "
631,"708232806.0","performing the 31st you "
632,"708232806.0","performing the 31st you "
633,"708232806.0","our plumbing 31st they sent you "
634,"708232806.0","part of the Coca-Cola so that's 48402 long Angela Mosey flu how long of a job that's the only thing so I will Friday I can do morning okay Frank are you asking me no problem whore hello I can't remember reschedule hello who's available it would be like a hurt okay okay okay I can I was performing again on the 31st "
635,"708232806.0","part of the closing so that's 48402 long Mikey School how long of a job bro see that's the only thing so I will Friday I can do morning okay Frank early afternoon no problem reschedule hello who's available Thursday afternoon it would be like a okay I can Alex movers are coming back on the 31st at you bye bye "
636,"708934422.0","summer "
637,"708934422.0","I get to take it home this weekend confirm "
638,"708934422.0","okay I get to take it home this weekend coupon "
639,"708934422.0","I get to take it home with me tonight confirm "
640,"708934422.0","I get to take it to confirm "
641,"708934422.0","okay service I get to take it home with me tonight confirming "
642,"709575519.0","just County at Fry's or not but anyways "
643,"709575519.0","I will call her I'm coming there first thing in the morning but he loaded sir on Thursday or Friday alright so we'll see what the problem is and then go from there ahead bye bye "
644,"709575519.0","my birthday girl we were looking for this phone some of your first thing in the morning but he loaded sir on Thursday or Friday alright so they will not be nice to see what the problem is and then go from there so that was for ohh hold on "
645,"709575519.0","service Maria thank you alright some of your first thing in the morning between Lucerne on Thursday or Friday alright so we'll see what the problem is and then go from there so that was for okay hold on "
646,"709575519.0","I'm coming there first thing in the morning because it is III Thursday or Friday alright girl see what the problem is and then go from there ohh hold on a minute bye "
647,"709575519.0","my birthday we were looking for the song coming first thing in the morning but Taylor day sir on Thursday or Friday alright so we'll see what the problem is and then go from there ohh hold on "
648,"710126721.0","morning your office Chinese heart heart heart one who started after May 22nd Jason well I suppose okay 100 office yes because she's not up I am happy to come John one key makers Mr okay the me I just the lady at 4 so can you please look into this that shouldn't happen and she didn't okay my phone number at the store 2664 Cassie girl my name is ran I'm calling regarding pretty high heels "
649,"710126721.0","well I'm calling regarding your office Ron Paul 22 Charter One quarter after May 22nd Jason well I suppose hey 100 if it's more than half yes cuz she's now that I am happy to come John when he made information I don't have Mr okay I just the lady at 4 so can you please look into this accident happened and she didn't okay my phone number 2664 Casa girl my name is ran I'm calling regarding Pauline idea thanks bye "
650,"710126721.0","morning your office to your office Chinese Charter One quarter Jason well I suppose okay 100 office phone yes because she's not about to call me John when he made credit card information I just the lady at 4 I think so can you please look into that shouldn't happen and money she didn't eat somewhere okay so please so call me back or email my phone number at this time 2684 Cassie girl my name is ran I'm calling regarding 29 thanks bye "
651,"710126721.0","morning your office to your office 22 hark hark one for her my 20 second Jason well I suppose hey 100 office yes she's not up I am happy to come John when he made I don't have Mr okay the me I just the lady at 4 I think so can you please look into that shouldn't happen and I mean she didn't eat somewhere okay so please call me back or email my phone number at this time 2684 Cassie girl my name is ran I'm calling regarding 29 thanks bye "
652,"710126721.0","morning your office to your office Chinese Charter One quarter Jason well I supposed to pay 100 yes because she's not about her talking to Comcast John when he made a card information I do have Mr okay I just a lady at 4 so can you please look into those tests for the house and she didn't okay my phone number 2664 Cassie girl my name is ran I'm calling regarding pretty high heels "
653,"710126721.0","funny your office to your office 22 hard part one starts May 22nd Jason well I suppose okay 100 office yes because she's not up I am I heard you to call me John when he made credit card information I do have Mr okay the me I just the lady at 4 I think so can you please look into those that shouldn't happen and I mean she didn't give me somewhere okay so please call me back or email my phone number at this time 2664 Cassie girl my name is ran I'm calling regarding 29 thanks bye "
654,"710293474.0","my I think I can make you smile yo bro alright the problem God that's cool hi cook again on Friday okay alright her next week Mondays a holiday I do have to Facebook and pearl of the girls could come by okay we will call the middle form before we arrive because we're home in the morning so to be you'd like I could call me before 3 alright purpose I think you bye "
655,"710293474.0","my I think I can make you smile the problem Free Press I put the thing on Friday alright Herman I have Tuesday fucking Carl of the day with her if she could come by okay give you a call he's in Middletown before superhero Island doesn't come in the morning so if you'd like I could call me before 3 I think you bye "
656,"710293474.0","smile yo bro alright the problem that's cool I put the game on Friday okay alright so next week Mondays a holiday I do have to say fucking car love the girl that you could come by okay give me a call he can little time before we arrive because we're home in the morning so it'll be like after call me before 3 "
657,"710293474.0","my estate how can I borrow alright the problem Chico I put the game on Friday okay alright her next I have Tuesday fucking car love this girl said he could come by okay give you a call he can little time before we arrive or when done doesn't come in the morning so if you'd like I could call me and before I say alright bye bye I think you bye "
658,"710293474.0","Maya said how can I borrow yo bro alright the problem that's cool I put the game on Friday okay alright so next week Mondays a holiday I do have to say fucking car love the girl he could come by okay give you a call he can middle form before we arrive Allen Dennison he doesn't come in the morning so if you'd like I could call me and before nothing Mr alright purpose "
659,"710293474.0","Mya Mya Joe Greg over here alright that's the problem battleship furnace God that's cool I put the game on Friday alright permit you have to say fucking cause of the girls could come by okay give me a call he can middle form before we arrive Allen Dennison doesn't come in the morning so if you'd like I could call me and before anything alright perfectly okay bye bye I think you bye "
660,"710613563.0","alright bye "
661,"710613563.0","okay "
662,"710613563.0","no I'm I don't want to move through online "
663,"710613563.0","okay "
664,"710613563.0","okay alright bye "
665,"710613563.0","I'm since I don't "
666,"710832369.0","hello your call 5045 our hours are Monday through Friday 7:30 to 4 p.m. Maria Friday 7:30 a.m. to 4 p.m. or people Norfolk and have a weekly call "
667,"710832369.0","hello your call 5045 hours are Monday through Friday 7:36 p.m. Maria Friday 7:30 a.m. to 4 p.m. or people in Norfolk and have a return call "
668,"710832369.0","hello hi there for 5 hours are Monday through Friday 7:36 for Maria cos it sounds like Friday 7:30 a.m. to 4 p.m. or people they can have a return call "
669,"710832369.0","well hi there for 5 hours are Monday through Friday 7:30 to 4 p.m. 4x4 for Maria Friday 7:30 a.m. to 4 p.m. on it'll take and I will be clean up "
670,"710832369.0","hello your call 5045 hours are Monday through Friday 7:36 Maria from Friday 7:30 a.m. to 4 p.m. on people's email hey can have a return call "
671,"710832369.0","call 5045 hours are Monday through Friday 7:30 to 4 p.m. Maria Friday 7:30 a.m. to 4 p.m. on people people they can have a return call "
672,"711689133.0","wondering if I could schedule a service call where are on for samples are applying it's Rose Street 74745 if you have any spots available Dora "
673,"711689133.0","Dora "
674,"711689133.0","nautical "
675,"711689133.0","show me "
676,"711689133.0","wondering if I could schedule a service call where are examples are applying for 46 Grover Street 4745 you have any spots available door "
677,"711689133.0","Dora "
678,"712023794.0","so they're coming from the Wall Street Undertaker watch a pariah hey for like gum the bottom okay just give us a call going here in the car for the medicine prepay me where the water is coming from call going here in system ice one of our guys I would not lie come home okay okay can you give me a call I was the best number to see if you are I've got probably 9 90206 four nine okay I will put it in the notes and I will have all later on but I'll have to give you a call or you want to call me that we can have someone stop by and pick it up make sure everything is okay there okay alright bye bye "
679,"712023794.0","so they're coming from the wall through Undertaker watch a pariah okay a fruit formica my bottom okay just give us a call going here in the car for the medical company pay me where the waters coming call going here in system I'm going to Archive I would not lie come home okay okay to me give you a call I was the best number to see you our s dot every 9 902-0649 okay I will put it in the notes and I will have later on I'll have to give you a call or you want to call room that we can have someone stop by and just check it out make sure everything is okay there okay alright "
680,"712023794.0","no no so there's water coming from the Wall Street Undertaker wife a pariah hey 8 to 10 right formica my battery okay just get a call going here it's a car for the Medical Group anyway call going here in system ice one of our guys out with now come home okay okay can you give me a call I was the best number to see if you are guys got that one nine nine oh 20649 I will put it in the notes and I will have later on I have to give you a call or you want to call that we can have someone stop by and just check it out make sure everything is okay there okay bye bye "
681,"712023794.0","so they're coming from the Wall Street Undertaker wife Mariah okay okay formica the bottom okay just get a call going here and kick off for the medical company where the waters coming call going here until I just one of our guys out of milk come home okay okay can you give you a call I was the best number to see if you are Scott 999-002-0649 okay I will put it in the notes and I will have it later on but I have to give you a call or you want to call them that we can have someone stop by and just check it out make sure everything is okay there okay alright bye bye "
682,"712023794.0","no so they're coming from the Wall Street Undertaker wife Mariah okay I will for my son my father in okay just get a call going here and kick off for the medical Penny penny wars call going here in system ice one of our guys out now come home okay okay to me give you a call I was the best number to see you our s dot one line 902-0649 I will put it in the notes and I will have later on but I'll have to give you a call or you want to call that we can have someone stop by and just check it out make sure everything is okay there okay alright bye "
