"Unique Id","Call Id","Words"
430,"696910285.0","Google Crown service Maria speaking how can I make you smile whatever forever okay it is electric or it's Oscar if you after 4:10 around 10:00 what was the what is a convenient for you what up for Oklahoma top I will have died and I give you a call to reschedule then that would be that was on the right I like that later that disposal the next week is also fully booked pretty much three quarters of a day the 26th would be the first $0.05 group someone else that's the Coles okay or in the morning like around excessive hair I was reading tips instructions okay and then okay okay okay alcohol three pair outside I'll repeat okay Murano from not funny and then Parker all clear okay love you bye okay alright "
431,"696910285.0","crossword okay it is in the chorus ask her if you after 4:10 around 10:00 what was the what is a convenient for you what up for a cop I will have that I give you a call to reschedule that would be that was on the rise early so I will have to give you a call so like out later that going to be available for that disposal look like next week is also fully booked pretty much three quarters of the way there the 26th would be the first $0.05 group someone else that's the Coles 30 yeah okay or coming in the morning like around excessive hair I was reading tips instructions okay okay okay everything okay okay parasite I'll repeat okay okay you are so come on back order prefer all clear okay love you bye okay okay alright "
432,"697060650.0","I know "
433,"697060650.0","I know "
434,"697060650.0","bye now "
435,"697060650.0","I know "
436,"697060650.0","bye now "
437,"697060650.0","bye now "
438,"697524037.0","book repair 453 our hours are Monday through Friday 7:30 p.m. for Martha is now regarding furnace or Perkins "
439,"697524037.0","4453 our hours are Monday through Friday 7:30 p.m. for Martha regarding furnace or Perkins "
440,"697524037.0","forgot to 50453 our hours are Monday through Friday 7:30 p.m. for Martha is now regarding furnace or Perkins 4 p.m. "
441,"697524037.0","for 5 people 453 her hours are Monday through Friday 7:30 p.m. for Martha regarding Furniture Company "
442,"697524037.0","4453 our hours are Monday through Friday 7:30 p.m. for Martha at 4 regarding furnace working hours for 4 p.m. when you call "
443,"697524037.0","forgot to 5 people 453 our hours are Monday through Friday 7:30 p.m. for Martha is now regarding Furniture Company "
444,"697957857.0","Michael Pina if you can work it out you know "
445,"697957857.0","I prepare that way if you can working after our I'll let you know "
446,"697957857.0","I'm preparing working after hours you know "
447,"697957857.0","I'm preparing if you can working after hours you know "
448,"697957857.0","Michael pain if you can work it out you know "
449,"697957857.0","Michael Pina if you can work it out you know "
450,"698335836.0","Carmichael "
451,"698335836.0","okay "
452,"698335836.0","okay "
453,"698335836.0","we have an over so I'm like a little pool house do I don't know we covered M as in Mary AR h i n e appointment after work on a timer okay "
454,"698335836.0","Carmichael "
455,"698335836.0","my sister install we have an overlap so go on like a little pool house do I don't know where you cuz it's just ohh M as in Mary AR h i n e unless his appointment after work kind of timer okay "
456,"698441860.0","thank you bye bye "
457,"698441860.0","okay okay so is it no comma alright heart okay I have work for you before tomorrow I have time for a looks like a fucking time for tomorrow the 14th I can get someone there up early bird okay honey yeah alright Michael we have a study at home okay fine I will ask him for tomorrow I'll give you a call for tomorrow tomorrow night okay it's my have a great day and we'll talk to you tomorrow thank you bye bye "
458,"698441860.0","thank you bye bye "
459,"698441860.0","thank you bye bye "
460,"698441860.0","thank you bye bye "
461,"698441860.0","okay okay so is it no problem alright contact our the water heart okay leaving work for you before tomorrow looks like people come time for tomorrow for school so I can get someone there okay up early bird alright Michael we have a study at home okay Tony fine I will call her tomorrow time tomorrow baby comma okay okay it's my thank you bye bye "
462,"698841118.0","this is Christine I you guys coming out to my place this morning for new part I didn't work the exact same thing minute call me back "
463,"698841118.0","this is an idea I'm coming out to my place this morning she was our new part I didn't work leave actually I think it's all be there in a minute "
464,"698841118.0","hi you are coming out of my place this morning she was our new part I didn't work exact same thing I guess minute call me back "
465,"698841118.0","a minute call me "
466,"698841118.0","this is an idea I'm coming out to my place this morning who is our new part I didn't work leave actually I think M&S "
467,"698841118.0","minute call me back "
468,"699215555.0","okay if I don't answer this if you're saying how can we make me smile okay then work for you before okay and what's going on with your condition call Erica we send over invoices via email when we have to have someone today okay yeah for Electro so my hope it's a look at your furnace and your pricing an hourly rate okay and then upon completion I can take cash check Visa or Master hurt and so I have to schedule for tomorrow he's in the morning day is going have a preference "
469,"699215555.0","I guess I don't services what's going on with your super call Erica reseller for invoices via when we hope to have someone today okay well I could borrow for Electro so my income tax rate okay and then upon completion I can take cash check Visa or Mastercard and so I have a schedule for tomorrow he does have a couple holes in the morning as to where day's going if you have a preference "
470,"699215555.0","I guess I don't service at this time okay beautiful call Erica we sent over for it okay four letter so my fax could come a little bit take a look at your furnace as well we kind of your house which I'm surprised you're not paying an hourly rate okay and then upon completion you can take cash check Visa or Mastercard and so I have to schedule for tomorrow he does have a couple holes in the morning to wear day is going have a preference later tomorrow morning you're welcome "
471,"699215555.0","Google Finance services call Erica we sent over alright when will someone okay yeah so my inspector could come a little bit to look at your furnace as well we kind of your health where we are which check your prices you're not paying an hourly rate okay and then upon completion you can take cash check Visa or Mastercard and so I have to schedule for tomorrow he does have a couple holes in the morning I can do to wear day is going if you have a preference "
472,"699215555.0","hi Curtis this is Diana we make you smile work be before what's going on with your call Erica we sent over alright okay yeah so my fax could come a little bit to look at your furnace as well we kind of your house which check your prices you know an hourly rate okay and then upon completion I can take cash check Visa or Mastercard so I have to schedule for tomorrow have a couple holes in the morning kind of an update to wear day is going if you have a preference "
473,"699215555.0","okay if I don't answer this is Dana Braun okay what's going on with your call Erica Miller invoices via when we have someone today okay an idea for a show so much for coming I hope it's a look at your furnace as well and you're getting the door price which surprised you're not paying an hourly rate okay and then upon completion I can take cash check Visa or Mastercard so I have in the schedule for tomorrow in the morning I can kind of a day is going if you have a preference later tomorrow morning you're welcome "
474,"699379437.0","formation for me see it for someone to come out and give you an estimate Parts okay I guess what your current water heater working okay at this point to learn how's it done work for you before okay okay better for you there 11 thank you so we're looking forward if I can get someone out there Wednesday morning or afternoon are you I can do our between 9 and 1 "
475,"699379437.0","I can do it between 9 and 11 "
476,"699379437.0","I can do our between 9 and 11 "
477,"699379437.0","I can do it between 9 and 11 "
478,"699379437.0","I can do our between 9 and 11 "
479,"699379437.0","I can do our between 9 and 11 "
480,"699550985.0","Aero 0 2 0 3 I'm having a problem here for underscore 10 our first what I'll do is I will have Diana call you tomorrow are you home okay I will have a number okay then thank you bye bye "
481,"699550985.0","service to make you smile 0 2 0 3 I'm having a problem here before underscore 10 is there I do have our first I will have to call you tomorrow I will have to confirm exhaust Packer MasterCard one of our home protection plan member okay yes tomorrow thank you bye bye "
482,"699550985.0","good morning eat at Moe's calling you in love this is really a problem I'm Christin leaking in the basement of you guys this morning I've been in the kitchen sink with after the way through and that's what stripping into the basement hey Simon cole correct your home number underscore underscore 10 sympatico dot c a c dot c a okay okay fine okay I'll pick up the kids because I like I said last night I thought it was the rain I thought it was the reason I'm going to go get down there now but I don't know if this is a good time to talk on the 1st so I looked under the sink this morning that's what it is it's a tablet case my husband needs to do all this and every parent do it hey going to call me first before you come down okay thank you very much okay "
483,"699550985.0","Home Service Marcus because I could make you smile 0020 3 I'm having a problem here underscore Tech is there our first tomorrow so I will have to call you tomorrow to confirm exact remastered heart one of our home protection plan member okay tomorrow thank you bye bye "
484,"699550985.0","make you smile 00203 I'm having a problem right before the underscore Tech our first I will call you tomorrow I will have to call you tomorrow to confirm exactly check or Mastercard one of our home protection plan member okay yes tomorrow thank you bye bye "
485,"699550985.0","yes good morning this is Edith most calling you in London phone number to fix a problem I'm for some reason checking in the face of you guys this morning underneath the kitchen sink without the way through and that's all stripping into the basement this is diamond correct home number under underscore 10 sympatico dot c a c dot c a I'm okay Wendy her good okay okay I'll get to 6:00 like I said last night I thought it was the rain I tried to put the reason I'm in fucking fuck it down there now but I don't know if this is a good time to tell attack on so I looked under the sink this morning about what it is it's a tablet case my husband needs to do all this thing I can't do it I will call him he'll so hey going to come before he comes out okay thank you very much bye bye now "
486,"699630620.0","home protect what is it August of last year was the last a little bit but I can get you in at anytime from now good night are you a couple of providers here for a funny thing here 7 or press 75165 now good time that works better for you I can get you in tomorrow Thursday morning afternoon hopefully train I can do late morning early afternoon later afternoon I've got firm so close someone give you a call when they're both out of work like 15 minutes maybe forecast for tomorrow afternoon Apple server "
487,"699630620.0","Cathy Mercer and I have the furnace protection I'm think I'm due for a furnace check but I would like you to look it up it's 26 black Acres Boulevard it was August so I can I booked an appointment now for Uggs no I can be home pretty much anytime however if you give me a date that I might be more specific okay what city does the 20th arms okay time on the 20th early afternoon work well 12:00 would be fine great thank you bye "
488,"699630620.0","Cathy Mercer and I have the furnace protection I'm think I'm due for a furnace but I would like you to look it up 26 black kickers Boulevard it was August so I can I booked an appointment now for all okay no I can be home pretty much anytime however if you give me a time I'll be more specific oh cool okay what city does the 20th okay what time on the 20th early afternoon work well 12:00 would be fine great thank you "
489,"699630620.0","Kathy marker and I have the furnace protection I'm think I'm due for a furnace check but I would like you to look it up it's 26 black Acres Boulevard it was August so I can I booked an appointment now for all okay no I can be home pretty much anytime however if you give me a date that I might be more specific okay okay what city does the 20th arms okay time on the 20th early afternoon would work well 12:00 would be fine great thank you bye "
490,"699630620.0","Cathy Mercer and I have the furnace protection I'm think I'm due for a furnace check but I would like you to look it up it's 26 black Acres Boulevard it was August so I can I booked an appointment now for Uggs so I could before yeah okay no I can be home pretty much anytime however if you give me a date that I might be more specific okay okay what city does the 20th okay I'm on the 20th early afternoon work well 12:00 would be fine yeah thank you bye "
491,"699630620.0","Kathy marker and I have the furnace protection I'm due for a furnace but I would like you to look it up it's 26 black Acres Boulevard it was August so I can I booked an appointment now for Uggs okay you know I can be home pretty much anytime however if you give me a time it'll be more specific okay what city does the 20th arms okay what time on the 20th early afternoon work well 12:00 would be fine thank you "
492,"701599813.0","from your friend from your friend to the side of the house I was okay alright moment take thank you I can keep coming for me to someone I can I can today if you are available we will see what I see what the problem is and then go ahead and put it in for a password and give you an accurate price Barbershop an hour it is 5 o'clock so he's going to like I said we'll go ahead from the price supposed to repair them properly it's two separate home or on the second one 3 her okay so they will bring the ladder any shipment that they may need and then from then on it'll be $69 per minute helping him Acura parts information address and so forth and then we can scheduler I have the means to me 4 okay number 945-727-0124 once work number okay okay dark for a Friday I will schedule but if that is if I can get them there in the morning which would be cold is that okay okay yeah okay I will have this Friday between 38 and $59 I'll let you know after when you get home you know comes on cash check Visa or Mastercard okay who outdoor story home hi okay thank you "
493,"701599813.0","from your from your to the side of the house house okay alright one moment please thank you hi there go to someone I can if you are available come on people see whether see what the problem is and then go ahead and put it in a passport barber shop and we'll go ahead from her price what what is needed to go ahead and give you a price for both to to repair them properly is it two separate home or on the cell okay so they will cross we will bring the ladder any shipment that they may need and then from then on it'll be $69 per minute Oakland Acura parts problem her some information address and so forth and then we can scheduler I have the new permit America for okay okay okay 472-701-2414 okay what are guys off for a Friday I will be on schedule but it's either the 29th or I can get them there first thing in the morning which would which would be easy to pull it is that okay no but other than that okay yeah okay I will have to serve it Friday between 30 it'll be $59 I'll let you know after when you get home so let me know when he's on the card okay who outdoor story homes okay thank you okay bye bye "
494,"701599813.0","from your from your the side of the house house okay alright one moment please thank you okay if you are available we will see what the problem is and then go ahead and put it in a popcorn Apple stock price price for both to the repair them properly is it for two separate home or on the 2nd okay from Bennett Oakland Acura parts okay okay I'm information address and so forth and then we can scheduler I have the permit committee 4 okay 477-0141 okay okay weather for a Friday I will schedule it is Friday the 29th I can get them there first thing in the morning which would be which would be easy to get a hold of you problems okay this Friday between 38 and $59 and let you know after when we get home so let me know when he's on so I will take cash check Visa or Mastercard okay outdoor story homes okay customer supplied thank you "
495,"701599813.0","thank you "
496,"701599813.0","thank you "
497,"701599813.0","thank you okay bye "
498,"701605286.0","1770 "
499,"701605286.0","770 "
500,"701605286.0","paragon "
501,"701605286.0","1770 "
502,"701605286.0","hurry "
503,"701605286.0","1770 "
504,"701704499.0","okay thank you bye bye "
505,"701704499.0","okay thank you bye bye "
506,"701704499.0","okay thank you bye bye "
507,"701704499.0","Christmas location is Austin okay cool cool decide to turn it off when okay alright all right now I'm available I'm available for 2 days and I'll give you a call tomorrow when he's available or have them are you available tomorrow decision hi there are you available tomorrow between 9 and 11 alright okay thank you bye bye "
508,"701704499.0","your pricing is Austin okay school good time okay alright all right now I'm available press 8 available for today I'll give you a call tomorrow when he's available have a are you available tomorrow decision hi there are you available tomorrow between 9 and 11 okay alright okay thank you bye bye "
509,"701704499.0","okay thank you bye bye "
510,"701917174.0","fashion is there any way okay "
511,"701917174.0","fashion is there any way okay "
512,"701917174.0","so not sure how fast you get is there any way okay bye "
513,"701917174.0","fashion is there any way okay "
514,"701917174.0","fashion okay "
515,"701917174.0","fashion okay bye "
516,"701984202.0","okay perfect "
517,"701984202.0","acrimonious July good morning afternoon Costco's to California that okay okay perfect bye "
518,"701984202.0","okay for Miss Maria July Morning to California that okay okay perfect bye bye "
519,"701984202.0","Chico California before July Gulf coast to California that okay okay "
520,"701984202.0","okay perfect "
521,"701984202.0","okay perfect "
522,"701988014.0","hi Maria it's me again but Dr Seema this coming Wednesday not if you don't have them who be kind okay well we were working out "
523,"701988014.0","Mike Mike he's not looking it's going to be coming home "
524,"701988014.0","hi Maria it's Dr gosh Wednesday not this coming Wednesday not the one 311 who will be kind okay well we were working now thank you "
525,"701988014.0","alright my keys at look for sign ups going to be "
526,"701988014.0","my keys at the person that's going to be coming home "
527,"701988014.0","hi Maria it's Jeff calling again but the plug in the dryer stuff so they were going to tell him that this coming Wednesday not Wednesday movie time okay alright we're working out "
528,"702358586.0","I'm over here no worries thank you have a permit ready "
529,"702358586.0","hi Lauren how are you you still okay so you're answering Harper yeah that may be good we are at the house is not I do business with them Tube8 you lie to me I'm over here no worries thank you have a penetrating "
530,"702358586.0","hi Lauren how are you can you steal I think it's closed today okay so you're in Concord yeah that may be good you are at the house is not I do business with them about to leave me I'm over here no worries thank you have a permit ready "
531,"702358586.0","YouTube "
532,"702358586.0","hi Lauren how are you I'm sure you're still okay so you're answering Harper yeah that may be good we are on for the house is not I do business with them I can't I have no worries thank you "
533,"702358586.0","YouTube "
534,"702749010.0","I can make "
535,"702749010.0","grow Sprint service "
536,"702749010.0","I can leave "
537,"702749010.0","I can leave in the morning "
538,"702749010.0","I can make you come home "
539,"702749010.0","I can make "
540,"703275545.0","okay Michael Savino what he looks like he's phone numbers are still the same page how I feel and why the home protective payment right alright for one of our technicians to come out to go over that with you see what the problem is and get you guys going to be here I guess I'm free for today hello first available is next season if you have a cancellation Google someone to give you a call just looking at the schedule here at the Delco back unless I can get someone at the end of the day with Indians our phone I'm going to be done could I could be something very minor actress how do I go about that okay okay well I'll put you in for Friday so excited okay 2 in the afternoon when are you available someone could call me to confirm for sure I'm there okay I will give you a call back you know something comes up okay "
541,"703275545.0","okay how can I make you smile for Michael so he knows what he looks like he's phone number to the same and you are the home protected for me right Alright I want to come over so cool that we probably can get you going to see here I guess anybody for today first available is next weekend if you have a pencil April and get someone to give you a call the CRV all caught up on this I can get someone at the end of the day and being.com as long as I could I Kool-Aid it if it could be something very minor after this hi there Carl eyes are so cool okay I will I'll put you in for Friday Friday be okay then in the afternoon are you available for Furniture Warehouse okay alright give me a call when you can talk okay "
542,"703275545.0","okay how can I meet you Michael Savino what he looks like he's phone numbers are the same and you are the home protected for me right Alright for one of our customers so go over that with you see what the problem is and get you going and to see here I guess but for today first available is next season if you have a cancellation good someone to give you a call looking at the schedule here be all caught up on this I can get someone at the end of the day and being.com I'm going to be done could I it could be something very minor actress how do I go about that okay okay well I'll put you in for Friday so excited okay 2 in the afternoon when are you available for I will have someone to confirm hooked up so come on out there give me a call back you know it comes up okay "
543,"703275545.0","Michael Savino what you look for our t-shirt phone number to the same and you are the home protected for me right Alright so cool that I can get you going buddy for today first available is next season if you have a pencil April and get someone to give you a call just looking at the schedule here at the Delco back unless I can get someone at the end of the day with him being careful I wonder does could I this could be something very minor actually how do I go about that okay okay well I'll put you in for Friday 6 I'll be up later in the afternoon when are you available I will have someone could call me to confirm for sure okay I'm going out there okay you know something comes up okay "
544,"703275545.0","okay Michael Savino what you look for our fees phone numbers are still the same taken we're on your the home protected for me to write alright for one of our demos still go over that with you see what the problem is and get you going to see here I guess sleep at home hello first available is next Tuesday if you have a cancellation I can get someone to give you a call just looking at the schedule here at the Delco got them if I can get someone at the end of the day like I'm being careful I'm going to be done could I hi Gregory boys are so cool okay well I'll pick me incorporated excited okay then in the afternoon I'm available or someone could call me to confirm for sure okay I'm going out there okay I'll give you a call when you know something comes up okay "
545,"703275545.0","okay Michael Savino what you look store hours phone numbers are still the same thing how I feel and why the home protective painting so great alright for one of our technicians to come out so close it out see what the problem is and get you going and to see here I guess buddy for today first available is next season if you have a cancellation in case someone to give you a call just looking at the schedule here at the Delco back unless I can get someone at the end of the day and then being careful as long as I could I call me today could be something very minor after this how do I go about that okay okay well I'll put you in for Friday excited okay I'll ask her know when are you available I will have someone could call them to confirm for sure okay almost there okay I will give you a call when you know something comes up okay take care "
546,"703335555.0","hi it's Jennifer Michelson calling I'm calling from Memorial Funeral Home in London hi I just God I just wish everything Park Road East between parking Library I know your day or so have a funeral that might be it's right away next week early we're here til at work if I can get someone here earlier I think you I think apps between 8:30 yes that's fine okay thanks a lot okay thanks "
