"Unique Id","Call Id","Words"
547,"703335555.0","hi it's Jennifer Michelson calling I'm calling from Memorial Funeral Home in London hi I just look at it just service for Elliot parking Library I will make her feel better if we had it checked it okay have a funeral so that might be this right now next week early we're here til a walk if I can get someone here earlier I do between 8:30 yes that's fine okay thanks bye okay thanks bye bye "
548,"703335555.0","hi it's Jennifer Michelson calling I'm calling from Memorial Funeral Home in London hi I just look at it just insure everything have a funeral so that might be the trailer main hallway next week early we're here til at work if I can get someone here earlier I think you have between 8:30 that's fine okay thanks a lot okay thanks "
549,"703335555.0","hi it's Jennifer Michelson calling I'm calling from Memorial Funeral Home in London hi I just look at it just insure everything for Elliot parking Library I know your day or so have a funeral that might be it's right away next week really we're here til at work if I can get someone here earlier I think you I cap between 8:30 yes that's fine okay thanks a lot okay thanks bye bye "
550,"703335555.0","hi it's Jennifer Michelson calling I'm calling from Memorial Funeral Home in London hi I just God I just wish everything Park Road East between parking Library have a funeral that might be it's right in the main hallway next week early we're here til at work if I can get someone here earlier I need to do I cap between 8:30 that's fine okay thanks bye okay bye bye "
551,"703335555.0","hi it's Jennifer Michelson calling I'm calling from Memorial Funeral Home in London hi I just look at it just service parking Library yes I know your day or so have a funeral so that might be it's right away next week really we're here til at work if I can get someone here earlier I think I can catch up between 8:30 yes that's fine okay thanks bye okay thanks bye bye "
552,"703730672.0","I'm pretty certain "
553,"703730672.0","I'm pretty certain "
554,"703730672.0","I'm up appointment with her to the electrical work at my home phone I'm wondering what you have a scheduled for an interview the 24 that sounds like she's going to go back into work yeah not Monday "
555,"703730672.0","I'm pretty certain "
556,"703730672.0","Coco's appointment with her to fix the electrical work at my home what you have several cancer and then the 23rd just a second looking at Monday morning "
557,"703730672.0","appointment with her to get some electrical work at my home what you have several kinds of the 23rd looking at Monday "
558,"703846494.0","tell me you know it's on 2nd Street okay I guess you have somebody come out I take her to the scope in an upstairs bathroom because the very old one answered some of the news hourly rates are Cody alright "
559,"703846494.0","it's our job "
560,"703846494.0","it sounds like an hour but it's all "
561,"703846494.0","tell me you know Asian on 2nd Street okay I guess I should have some time I got a 1 acre in an upstairs bathroom and because the very old one and some of the new hourly rates are alright "
562,"703846494.0","before the start of work "
563,"703846494.0","tell me you know Asian on 2nd Street hey I guess I have some in an upstairs bathroom because it would just be to be the one that was a very old one in stray shins are Justin order to me some of the news hourly rates are golden what I mean "
564,"704211629.0","calling for her Services Chico's important to us please stay on the line and we'll be right with you hey Terry sister Terry's speaking what is your name okay how do you son God yeah they're not even quite yet this morning how do you spell your to you I can take me for me to have them call you when I can I'm hoping okay you're welcome "
565,"704211629.0","calling for Home Services Chico's important to us the line and we'll be right with you Neighborhood Services security key okay how do you spend that they're not in quite yet this morning how do you say April I will have them call you when I can star I'm hoping anyway okay you're welcome I know "
566,"704211629.0","thank you for calling Financial Services Chico's important to us please stay on the line and will Bright review stay on the road Neighborhood Services Cherry speaking what is the name yeah they're not in quite yet this morning how do you say April I can take me for me to have them call you when they come in so we are I'm hoping you're right okay you're welcome "
567,"704211629.0","calling for an in home service it's important to us hello Bright review stay on the road hey Terry sister Terry's speaking okay what is your name okay how do you spend that they're not in quite yet this morning how do you say yes you will have them call you when I can I'm hoping okay you're welcome "
568,"704211629.0","thank you for calling Financial Services Chico's important to us please stay on the line and we'll be right with you Neighborhood Services security key what is the name okay I'm sure Heidi's yeah they're not in quite yet this morning how do you spell April I can take me to have them call you when they come in okay you're welcome "
569,"704211629.0","thank you for calling for an in home services Chico's important or the line and we'll be right with you hey Travis it's Jerry speaking okay I'm sure Heidi's yeah they're not in quite yet this morning how do you spell your I can take me for me to have them call you when they come in don't we are I'm hoping anyway okay you're welcome "
570,"704213382.0","I'm calling back they probably not since it's part of the day is going to make up work maybe some Anderson from from where I know there there might be somebody to me to be canceling tomorrow so anyway "
571,"704213382.0","Franklin gun safe and part of the day is going to make up work maybe Anderson from from where I know there there might be somebody to me to be canceling tomorrow anyway "
572,"704213382.0","Curtis Clinic Whataburger Crafters you're welcome "
573,"704213382.0","I'm going to probably not since it's part of the day it's going to work maybe Anderson from where I know there are there might be somebody to me to be canceling tomorrow so anyway "
574,"704213382.0","Whataburger afternoon you're welcome "
575,"704213382.0","I'm going to say 7:10 so it's kind of a it's going to work maybe Sunday Anderson Cooper Square I know there there might be somebody to me to be canceling tomorrow so anyway "
576,"704214586.0","so you want it disconnected store okay okay August phone number hey I realize it's a member of ours the next available okay after that Bessemer available Sears definitely know they will be a $59 discount are you taking the come on site will go over everything first cousin accurate price then go ahead with with it will take to pass by Visa Mastercard I think so Thursday or Friday after free Thursday afternoon that would be after 12 o'clock so we can give you a call when someone will be on their way with us okay "
577,"704214586.0","to book an appointment for an electrical shop have a new phone I just want to fuck replacing 42 green 14725 534 shows it being lost a lot there's a Time on Wednesday morning right okay thank you "
578,"704214586.0","the book an appointment for an electrical have a try just one box between replacing 42 green 94725 534 shows it being zero cost a lot there's a Time on Wednesday morning okay okay "
579,"704214586.0","so you want it disconnected yes store okay okay phone number hey I will pick up the phone number of our send me pictures of the next available okay after that someone available here just let you know they will be a $59 discount are you taking the come on site will go over everything first is an accurate price then go ahead with with epic accept cash check Visa MasterCard I do have Thursday or Friday 3:30 afternoon that would be after 12 o'clock so we can give you a call when someone will be on their way but that's it okay great "
580,"704214586.0","so you want to disconnected remove door okay okay phone numbers are still the same there Paul hey I will take place in Cole member of our the next available okay after that someone available here definitely know they will be a $59 dispatch are you taking the come on site will go over everything first cousin I can replace then go ahead with with it will take to pass take Visa Mastercard I do now Thursday or Friday after free Thursday okay afternoon that would be after 12 o'clock so we can give you a call when someone will be on their way but that's it okay "
581,"704214586.0","Okay Google Apple so you want to disconnected remove door okay okay August phone number hey I will have my phone number Barre the next available okay after that someone available Sears so this let you know they will be a $59 discount are you taking the come on site will go over everything first season I can reply Sanger headrest Lissa it will take the past take Visa MasterCard I do have Thursday or Friday 3 Thursday okay afternoon that would be after 12 o'clock so we can give you a call when someone will be on the way but that's it okay great "
582,"704901787.0","Aquarius where can I go find attorneys to give you an accurate price whore okay no problem I put a remote because he knows and then who wrote to say good night okay so how you heard it all okay perfect alright I'll have someone there I think ohh between 2 and 40 thank you "
583,"704901787.0","bye "
584,"704901787.0","bye "
585,"704901787.0","okay perfect alright I'll have someone there at Pecos between 2 and 40 thank you "
586,"704901787.0","okay perfect alright or have someone there he goes between 2 and 40 "
587,"704901787.0","bye "
588,"705472052.0","I forgot "
589,"705472052.0","for that "
590,"705472052.0","I forgot "
591,"705472052.0","the girl for summer "
592,"705472052.0","hey Todd Walker for that "
593,"705472052.0","after that "
594,"705735897.0","one of these seconds are talking about replacing old 60 amp fuse pills does anybody there that might be able to answer a couple of questions so can you switch the breaker panel yeah I guess that's the big car city of Malden Mass like to be have to come I was in they have to come and just connect or the feed from the street no comma credit card becoming disconnect and charger for a meter McLennan Haider won't charge it to the house it sounds like it's all done through the electrician yesterday my dad's house so I'm going to talk with them first to find out I'm lying Whispers hey John give me a call back when do next month or anything at least when are around and then what I'll do is I'll come back and schedule an appointment and I can just go through everything alright have a great call back "
595,"705735897.0","who are you the website and looking at one of these sessions are talking about replacing old 60 amp fuse does anybody that may be able to answer couple your questions fucking sweet to breaker panel yeah I guess the big question bar city of London master like to be have to come I was in they have to come and just connect or the feed from the street okay no comma credit card having disconnect and charger for a meter McLennan Haider won't charge it to the house it sounds like it's all done through the electrician yes sir this dad's house so I'm going to check with them first if I know I'm lying Whispers hey John give me a call back okay when do next month or anything at least when are around and then what I'll do is I'll come back and schedule her appointment and I can just go through everything alright give me a ring call back "
596,"705735897.0","one of these II are talking about replacing old 60 amp fuse pills does anybody there that may be able to answer a couple of generic questions about getting the switch the breaker panel yeah I guess the big question is are city of Malden Mass like to be have to come I was able to come and just connect or the feet from the street no comma credit card becoming disconnect and charger for a meter McLennan Haider won't be charged it to the house it sounds like it's all done through the electrician dad's house so I'm going to talk with them first if I know I'm line which person hey John give me a call back when do next month or anything at least when are around and then what I'll do is I'll come back and schedule her appointment and I can just go through everything alright give a great time call back "
597,"705735897.0","one of these sessions are talking about replacing old 60 amp fuse pills does anybody there that may be able to answer couple your questions so get in the switch the breaker panel yeah I guess the big question city of Malden Mass like to be have to come I was able to come and just connect or the feet from the street no comma credit card becoming disconnect and charger for a meter McLennan Haider won't charge it to the house it sounds like it's all done through the electrician yes sir this dad's house so I'm going to talk with them first if I know I'm lying Whispers hey John give me a call back okay when do next month's rent maybe at least when you're around and then what I'll do is all I'll come back and schedule an appointment they can just go through everything alright you have a great day perfect call back "
598,"705735897.0","who are you website and I'm looking at one of the second they're talking about replacing old 60 amp 2 pills does anybody that may be able to answer couple your questions fucking sweet to breaker panel yeah I guess the big power bar city of London master like to be have to come I was able to come and just connect or the feet from the street no comma credit card becoming disconnect and charger for a meter McLennan Haider won't charge it to the house it sounds like it's all done through the electrician yes sir this dad's house so I'm going to talk with them first if I know I'm line which person hey John give me a call back okay when do next month or anything at least when are around and then what I'll do is I'll come back and schedule an appointment and I can just go through everything alright give a great time perfect call back "
599,"705735897.0","who are you website and I was looking at one of the second they're talking about replacing old 60 amp fuse does anybody that may be able to answer couple your questions fucking sweet 2 breaker panel yeah I guess the big bar city of London master like to be have to come I was able to come and just connect or the feet from the street no comma credit card becoming disconnect and charger for a meter McLennan Haider won't charge it to the house it sounds like it's all done through the electrician yes Eric my dad's house so I'm going to talk with them first to find out I'm lying whisper hey John give me a call back okay when do next or anything at least when are around and then what I'll do is I'll come back and schedule her appointment and I can just go through everything alright perfect call back "