"Call Id","Words","Prospect"
"1046555387","not hung basic I just want to my house cuz I need my house I already talked to John about it and owner okay so he's going to call me sleep your name shirt comma I teach Sawyer s aw why ER yes our old house we the Ashley from for my friend I have a move to New Housesecond yeah yeah did you just electrical sorry so it's a certificate that I his first night bye who versus me here feel Faith and honey Pulaski Squares aw why ER man you are I think one glenroy Court L GL enn are aligned but supposed to Code 4 H 3 519-694-4329 and you know how much would that might just have him over yeah 12999 plus tax 129 9 can I do I have to pass that word or it's a Visa or Mastercard so I used my debit you know what I'll just pay cash and then so we don't have it doesn't have to Skype or anything like that you were available Monday afternoon at all yeah what time do o'clock or 3 o'clock let's need this we o'clock Monday as well okay thank you bye bye ","Sales"
"1046845239","Maria Maria how's your day going my name is Alex I'm just calling in regards to any possible ship programs in plumbing you do anything ","Service"
"719446661","you have is there nobody say something in the bathroom and then also just and that's press just need somebody alright ","Service"
"1046965393","they're finding impressive saying I'm going to keep plan Hi how are you how are you I am fine text you I want to see if first how do you to come and shut my electric power in my house check it for Forest Hill Circle thing on my AC on my order to our alliance came and they said they don't want to do any repair unless they know that there's no problem with the filters and hydro the hydro came today the technician said the voltage in the house is open but he says he needs another person to come a look at them if there is any fuses off or anything because hyper from Johnson okay so I need somebody to check that I don't know if all those circuits are incorrect or if there's a fuse blown I have no idea okay now the only problem is I'm I'm looking kind of wet and Wednesday of more oh that's a very long time already out of gas out of a see I know it's hardbut you can live with ACB daughter tank we can play for another week cuz it all out then the labors news so all we do have something else for you I keep an eye for know if you did cuz I got your insulin Valastro hey your first name please Sherry a RI BLT state blue Aga 63 a flash your phone number is971-9718 one I would like to know if you still have water because I'm out of I'm out of London and she's the one who's in there yet and the house she has she has what she does to Western University so we'll her scheduled as all over the place problem 519-719-2674 her name l a l i h I like that name it is very pretty see water heater okay so what I'm going to do is I'm going to put it in for Wednesday and I'm also going to flag Solutions I'll give you a call cuz I don't know why don't you find out what work for her and yeah we are not Paul just leave a message so it's like to our service and emailit to me and then I'll pay for whatever time you want you're welcome ","Service"
"719251169","wondering if you would have a part from the air conditioner with a an exhaust tube it goes out the window and wonder if you would have replacement for that ","Sales"
"1047085430","great they're fun and I'm saying to make you smile our then staying for Allison from a realtor I'm looking I don't know if you guys have anyone available tomorrow I got your I'm in my office here in electrical can done on a house on 4 knob and tube wiring in to see if we could add to the breaker the service the breaker panel I'm could you guys have anyone available tomorrow I know it's really short notice I'm sorryyour first name are Thomas p r e a l a s p as in Paul Office of the Home 33 Waterloo 633 Waterloo Street are you available tomorrow at 3 is there any way they could come earlier just when we have a cookie leave you such a rough time frame to show for the people to come through then again I apologize for mispronounced o'clock is perfect so much ","Service"
"1047125830","depending on how to make you smile because I wakeup to 1700 long and of a lady who for any water runoff taken off good morning this hey Mike how you doing hey I'm off on how you doing train to run a log into my lane way something like I said that you can either get past or plastic yeah and I take it obviously the cast is a lot more expensive but wetalked like 3 times or what anyway I'll be on for this afternoon I have to do some digging on I took the differences between the two of them okay if you want my point I have available for sometime I'm leaving this week we could probably get out the fee for her and what what do you want to do you wantto hook the center yeah there is there is a train like it's now we're in Old North so it is a terracotta play pipe okay that we know is in that area right only only because it has been Old North there's a there's a probably and sanitary line not a sore mouth now this is a storm line I actually got one end of it it was for a great of a window wells along the line we got your got okay I actually the other records Maxine High need for my cross Ariana Grande hot water through it it seems to still be in touch by the direction it's going it's going to be somewhere close to that okay so that wouldn't bea problem at all okay you said Friday okay so or if putting in all the heating right now okay eat at Lane way if there's any way to see Tony has any time but I'm more of the rate increase this word in a start they wanted for Friday so yeah even if he came and looked at it tomorrow I don't know if he's drunk and I'll be at his convenience okay no worries all our scheduling hello hey Mike I sent me back to you it's tough he's looking for me to come by to give me an idea on a French drain Scott young why ohh you and G 41 Mayfair Drive 682 + 7 okay and your phone number please 519 three one nine 4028alright did you want first thing tomorrow you'd be there between 30 yeah I can even be here today if you want he's a little today but definitely have a person yes my number if you want to give me a shout and help me one of the poor on Friday kind of just landed in our last week they change bag here'shonest a little bit if he does have any free time today I will drop what I'm doing a run over the house if he's right in the neighborhood thank you bye ","Sales"
"1047134960","Maria speaking how can I make it bye ohh good morning it's Redmond my electrical work for us earlier this summer and it was one item left me have Rob it's not an outlet this how do I clean this it says that Outlook now with the same state and letting you know when we're ready for electrical fences to come out I'm so we covered up we could meet up now and I wanted to let you know we're ready for an instance hey what up then and we don't need to come back to us and let us know yes it has been installed sense for you to Diana's voicemail she's in a meeting at the moment this and then he will get the inspector arrange for you hello refrigerator for Sam transistor Fox Point let me call my number here is 519-471-3741 how do some electrical work for us earlier this summer and the only outstanding matter was we would have put a plane flight off of LSI and now we've we've done that now and he asked me to do so call into the office and let you know we're ready for analytical instruments through one notes were home so doing that now and the number is 519-471-3741 if you need to give me a call back for more information or Warren cream bye ","Service"
"1047190631","you for calling fight in home service this is an how you doing today I'm well how are you good thinks I'm a real estate I'm using guys before you guys are great I have a client who is a seller in Old North End the inspection done in to cover that there's some David to Windows it tonight and you need quote and probably due to work before closing to get rid of all the knob into and I'm wondering what I know you guys are probably super busy but it's a bit of a time in a little bit of the essence I'm wonder if there's anyway you can help me over here sorry this was I thought this was the office yeah if you could just tell them to call Michael Pope regarding Robin to removal 19 851 2341 951-2341 okayI will send the message to their offense my flaws ","Service"
"1047222936","Rich Creative Smile hi we can do that for you or 3 before your first name address 9 Road postal code yes you don't you want some so yes you know we want to talk with them and give me some times and we can set it up so you are going to have to charge you thousands nice Alright and then call you back then thank you bye ","Sales"
"718942922","okay I'm home service yes you do Services 4 sure what I'm going to do if it's on the service call so I'll just kind of walkme through this week started okay for you service.com hi Colin Kaepernick okay yes that web poop cleaner code o'clock there okay phone number filler I'm one reopen up on out there tomorrow press 10:00 final ","Service"
"1047266245","it's a great buying home service thisis saying I have to make you smile hi I just had a service call my first one if the unit erneston Dishner glamour anyways everything was great I was telling him about my digital path there's does okay mean as I was telling him having network issue and if the only way that I can resolve it was to turnoff the power and then turn it on and he says I should not be doing that and he says if it happens to call you guys because it has been happening a shorter period so let's say yeah we're at 40 honeysuckle president wake your ass up yeah it's just me period teens a shorter now but I'm just talking andhe said to call the moment that it happened okay how many times you like how I said it like is it you know it's the first time I believe was in June so I have to restart in June and then sometime in August and then now I did it again and sorry if this trying to get as many notes as I can for them so cos to reset iComfort Wi-Fi almost once a month and you have to reset in order to for it to work at all yeah I ask them if there was a button on the devices I figured it'd be like easier than going and finding the search and then turning it all I need is there is it I'm not surprised so yeah he's justI ended up having to turn it off and then turn it back on and I shows assistance in order on your end this is ice I just waited and then 3 days later I'll pay like you know problem here so I read I turned everything off and turned back on at sitting this bye loses the condition between like being able to use it wirelessly I'll have someone come out and take a look charge obviously for the call and realistically something like happening often on something Abilene year old he'll probably before 4 and yeah those name so all right now my available availability I'm looking I could do Thursday do you have a preference of morning afternoon afternoon so what I'll do is I'll put it in for Thursday into the schools marable a trip here that you prefer thank you so much not a problem we'll talk see you bye bye ","Service"
"718915009","Super Bowl furnace again something likethat I am Chris okay just want stuff first available burger here he's got to go I believe the HUD home 4 After 5 for Friday 1112 anytime actually I'llput skills ","Service"
"718855737","700 ","Service"
"1047381317","Mr Bynum this is the sign on the clinic smile hi Diana my name is Linda Douglas and we're clients of York has a plan for a furnace inspection and air conditioners I was justwondering if I could an estimate Trail hey when do you want to have that done so I don't know maybe near the end of October or whenever you start going on or do you want us sooner have a we just in the schedule for the week and I'll be shut off on Monday and see what day works for you it sounds perfect for much bye ","Service"
"718754881","236-3407 ","Service"
"1047403478","it's Maria style I have someone come help me when you're conditioner I will then I will be with you as soon as possible I will await she was breath thank you where heard that on the website said you're not it's not blowing cold air just blows regular room temperature here is rolling like crazy so somewhere in the internal medicine 809 dear Ridge Place on Earth Shop phone number you are correct alright so I will schedule our technician are you well what is your problem later today if that's possible I will give you a call if I'm not in my vet and then we can be moral I'm home and everything sounds good thank you ","Service"
"1047406570","it's a great day at find it on the services within a half mile good but so hey what are you guys come over and do an estimate and all that good stuff you may have them many years ago what's your address and I'll see if you're in the system I have the phone number is 504-3525 and then I also have 5.99 or 5 yes I have someone available tomorrow between 1 and 3 Tuesday or Wednesday the 5th Mike's Bikes ","Service"
"718723924","furnace motor I'm going to be at the focus could have our service tech come out Running part Mills and my LLS 415 Hart 8:45 51960 nine six nine alright ","Service"
"718583161","I will call the know ","Service"
"1047659242","calling for in home service it's Terry how can I make a call hi there I'm just leaving for Toronto unfortunately and I just see my furnace is leaking is there anything you can help us after hours will can they and they come like 2 yeah if you accept those the way too long yeah I don't get any in your home don't know how that works my cell too many answering service for us to let you know that it's $9 for a couple of days did you just have them come what is your name then sorry Penney's at AR p a t a n y okay the address 41 Hollis Street 519 +981-959-679-8195 yep and you are on there from you yep I will have a long time my way to take them is there anyway of knowing that those I'll give you a call back shortly okay bye ","Service"
"1047737911","it's a great time to make you smile call to schedule a call for sale 240East Williams what do they do have open like Wednesday or Thursday of next week I'm working from home but yeah have a Wednesday morning would be Dandywhat time I'm going to put it in for first I'll be there all day I'm assuming sometime okay alright girls ","Service"
"1047858863","it's a great service this is Grand on a smile hello okay I'll be before 3rd David last name Har your address in Adra okay yep is there someone at home your wife at home and what's her name okay not a problem we can have someone out there by later this morning so do you want touch base with one someone over there Joseph you should be downstairs it should be arriving anytime soon had with her to you and I get how we work so we have a $59 match and Tonio for you he looked issues your wife all her off this prior to starting work she'll know exactly what she's too and then upon her approval will do the work right now Shaniqua pain cash checks or MasterCard okay I will I'll get Sarah our customer care specialist are no problems ","Service"
"1047910434","Chris this is miles tonight you're funny Charles was out an assessment on a broken air conditioner todayit is in support on the phone and I looks like I need a new air conditioner so period that's the one you I heard about it so I need I told me that I get so we Doyle and Oakland so I don't think you smile today I'm sorry so my problem is is that type of my wife are working okay I have there's a leak there this afternoon so I can come and do an assessment and then I need a quote as possible or we work till 5:30 we're home at 5:30 okay well that wouldwork better for us a little bit better Sorrento having to work Friday in a long weekend so far well actually in your area around that time I have her at 6 is perfect I'll be home for sex tomorrow night not a problem so it'll be great too alright bye ","Sales"
"1047998506","Diana hope you smile case to somebody else we got disconnected somehow I see here was going to get any of them one woman what happened of coffee well I had Tom from work yeah so I don't know there was a bad line so whether this cut out or whatever cuz I was being a lot flight from practice but because I'm assuming you don't work Saturday's at all so it's a says it's a boy working hours 4 after 3 is our stop flight well I sorry I saw awful smell no I know it's not going to start very early so after 3 would be if if we have someone by the time we can give you a call would you be home like 4 or 3:10 alright so I'll bring it home to me like fairly quick moment 3/3 Drive in Oxford Street so I can put it in the notes and if he's not he's going good day and call you by tonight dinner so I will keep you up and what time without us you need yeah so if it is we've got a musical or more so if we she's got a longer day then we can you know the hold of new in home for 390x piece set but normally what would not get off work well I said be home if you sit on my over time is 1:00 o'clock now I don't know why it does that if after 3 if he has another call that last week can you be home by 1 sometimes Idon't know yeah I just have you look at it to make sure I have to like going on but I have to be here for you I will put that in the note they can youlet us know when you find out I can tell you right call me maybe this is for 1 o'clock yeah I can be home by 1 o'clock so nice day alright tomorrow looks like a fairly light day for him so he could me too yep he's unable to do it like I said I can't guarantee I will put a note and then I will put it in perspective will be home for after one for him and again they will up and 10:30 on Saturday this and I will call you back just we have a meeting andif it's going to be late and I will stay off early tomorrow but more importantly should be here so 4 tomorrow for after them okay then those and I will tell you my work number because the hopper the number one 9 40 1200 21245 245 okay and then I will is the word called I know that our appointment fortomorrow give them your name and then we will go into it in or read just Fairhope and 14.84 so it'll be $9 dispatch so come on in we'll go over everything and I had any work when he's going to take class prep Visa or Mastercard can you charger but the only one I don't have a lot anymore for them yeahnow I have asked if you miss MasterCard that oh yeah very much bye ","Service"
"1047999914","Phil this morning hoping to hate Mile Hi my name's cousin and I was wondering if I think she is my toilet running but I'll work on him all the time somehow my water bills do both houses my everyone while I do but what's more like how many pennies half on and turn it off and her to turn on the water and turn off and I'm here alright I'll go home and I have two other Comfort Suites Lake Road e l y h o d are you are 46157 please yes are you home protection pin number but I don't know please talk what you think time do you prefer mornings or after well I work 3 now so I'll keep it's that we have really cry your plan I start work doing mother's off and I don't have that I Plymouth House yeah lots of somebody or when I work days I work 7 to 3 all this point no I don't working team for another like 2 weeks really nice to me and I know you don't work Saturdays ","Service"
"717835517","no problem not what comes with it you have more Harper morning quarter after 10:30 like most cruises child traffic you ","Service"
"717825713","I have a hot tub you 9333 Hudson from leader of a stutter the word powerful RC general price range in front of my house special boxes the back of my house at 6:30 p and in the hot tubs going to be like 3 feet from the house is it and then I just woke up from there yeah sounds good thank you ","Sales"
"717782452","hi there Curtis ","Service"
"1048057527","Maria speaking how can I make a prior I'm just trying to call make some inquiries please propose trying to fill in the now section of the website at singing when I was typing my name's Lee letters are allowed unless all is okay what so I'm not sure on the website for booking for booking an appointment for someone okay well recently we have aluminum wiring I've been here at the original wiring that was house we were wondering number one there's ever any type Grant to help homeowners to transfer over to the wiring I am an Oscar for electrical I'm not prefer electrical base and schedule a meeting is that jazz but yes it's Ted it's clean tenant dollars so we're looking at getting a quote as well as if there's a plan available you know to cover that cost problem I will schedule a time to come out he'll go over that with you go over everything with me here to do work for us over the years 01 you are when Sharon Reeves our ee Ze press Steve name first name is Kar en know we've been real Breckenridge ohh yes c k e n as in red and it's all one word okay Breckenridge yes it's probably more than 5 years I don't know you know we've been here supposed to 618 and the policies my number is 226-678-5552 Karen can you are V asin Victor is there an email I just want to know who is from mcma SAR like then Amanda and Sarah I am S as in Sarah Dr Roger's calm okay I think you'rethe only people that I've ever come here or are you guys and we knew that you dealt with aluminum wiring so my husband over the years we keep trying to you know put some money together to get get it done no problem I'll have them come out for you know the 4th mouth is yeah the course on I do like Tuesday Wednesday with a street or maybe you're on a Wednesday spear I drive so that's the you know the person so we will be home probably about 9:40 so say from 10 o'clock and clean 10 + 2 I can do a 10 o'clock 12 o'clock let's do 10 on the 5th on the stuff off with John right now I would look at this job okay okay ","Service"
"717713058","hey near here ","Service"
